Volume	Page	Line	KWIC	URL	Column
bsb10502006	00280	78	telbare Uebung der Einbildungskraft. IV. Unmittelbare Uebung	https://api.digitale-sammlungen.de/iiif/presentation/v2/bsb10502006/canvas/280/view	KLEINE SCHRIFTEN
bsb10502006	00307	84	gigantiſch, um die Einbildungskraft des Leſers zu he-	https://api.digitale-sammlungen.de/iiif/presentation/v2/bsb10502006/canvas/307/view	VERMISCHTE SCHRIFTEN
bsb10502006	00417	40	Wirkung der Einbildungskraft der Mutter auf das Kind	https://api.digitale-sammlungen.de/iiif/presentation/v2/bsb10502006/canvas/417/view	ARZNEYGELAHRTHEIT
bsb10502006	00418	17	vçohl in deſſen Einbildungskraft, (in der Einbildungs-	https://api.digitale-sammlungen.de/iiif/presentation/v2/bsb10502006/canvas/418/view	ARZNEYGELAHRTHEIT
bsb10502006	00418	22	Stelle des Halſes. Die Einbildungskraft der Mutter	https://api.digitale-sammlungen.de/iiif/presentation/v2/bsb10502006/canvas/418/view	ARZNEYGELAHRTHEIT
bsb10502006	00425	30	Einbildungskraft mit einer gründlichen und ausgebrei-	https://api.digitale-sammlungen.de/iiif/presentation/v2/bsb10502006/canvas/425/view	PHILOLOGIE
bsb10502006	00425	54	einer verſchönernden Einbildungskraft gezeigt hatte,	https://api.digitale-sammlungen.de/iiif/presentation/v2/bsb10502006/canvas/425/view	PHILOLOGIE
bsb10502006	00427	112	des Peregrinus zweifelhaft ſeyn. Die Einbildungskraft	https://api.digitale-sammlungen.de/iiif/presentation/v2/bsb10502006/canvas/427/view	PHILOLOGIE
bsb10502006	00529	74	dicht uber die Einbildungskraft ſo vortreffliche Morceaua	https://api.digitale-sammlungen.de/iiif/presentation/v2/bsb10502006/canvas/529/view	LITERARISCHE NACHRICHTEN
bsb10502006	00597	64	Rächſel, die Einbildungskraft beherrſcht den Verſtand.	https://api.digitale-sammlungen.de/iiif/presentation/v2/bsb10502006/canvas/597/view	LITERARISCHE ANZEIGEN
bsb10502012	00024	89	te, in das Gebiet der Einbildungskraft hinüber zu	https://api.digitale-sammlungen.de/iiif/presentation/v2/bsb10502012/canvas/24/view	PHILOSOPHIE
bsb10502012	00026	43	von der Einbildungskraft. Menſchenlehre in engeren - - -	https://api.digitale-sammlungen.de/iiif/presentation/v2/bsb10502012/canvas/26/view	PHILOSOPHIE
bsb10502012	00055	110	biger für Gehör und Einbildungskraft gleich unbe-	https://api.digitale-sammlungen.de/iiif/presentation/v2/bsb10502012/canvas/55/view	SCHÖNE KÜNSTE
bsb10502012	00074	9	ſeiner Einbildungskraft ein echtes Spiel gönnen will,	https://api.digitale-sammlungen.de/iiif/presentation/v2/bsb10502012/canvas/74/view	SCHÖNE KÜNSTE
bsb10502012	00126	117	zu bleiben, und die hunderttauſend Dinge, die ihn ſeine Einbildungskraft ohne Unterlaſs darbietet, von dem vorgeſetzen	https://api.digitale-sammlungen.de/iiif/presentation/v2/bsb10502012/canvas/126/view	KLEINE SCHRIFTEN
bsb10502012	00141	71	Bock, den er dem Gotte opferte.“ Wenn die Einbildungskraft eines Schriftſtellers die Quelle der Ge-	https://api.digitale-sammlungen.de/iiif/presentation/v2/bsb10502012/canvas/141/view	PHILOLOGIE
bsb10502012	00159	100	,,Einbildungskraft zum theoretiſch Erhabenen, wo die	https://api.digitale-sammlungen.de/iiif/presentation/v2/bsb10502012/canvas/159/view	SCHÖNE KÜNSTE
bsb10502012	00175	104	kraft, Einbildungskraft und Urtheilskraft, mit durch	https://api.digitale-sammlungen.de/iiif/presentation/v2/bsb10502012/canvas/175/view	ARZNEYGELAHRTHEIT
bsb10502012	00189	101	derſelben durch die Einbildungskraft zu thun iſt,	https://api.digitale-sammlungen.de/iiif/presentation/v2/bsb10502012/canvas/189/view	GESCHICHTE
bsb10502012	00266	75	haften Colorit der Darſtellung und an Wärme der Einbildungskraft, weit zurück bleibt. Leere Räſonne-	https://api.digitale-sammlungen.de/iiif/presentation/v2/bsb10502012/canvas/266/view	SCHÖNE KÜNSTE
bsb10502012	00290	42	„Sinnen, Gedächtniſs, Einbildungskraft, Verſtand, und ſelbſt	https://api.digitale-sammlungen.de/iiif/presentation/v2/bsb10502012/canvas/290/view	KLEINE SCHRIFTEN
bsb10502012	00366	49	ſondern Vortrag über die Einbildungskraft. – Ueber	https://api.digitale-sammlungen.de/iiif/presentation/v2/bsb10502012/canvas/366/view	ERBAUUNGSSCHRIFTEN
bsb10502012	00374	79	chondrie und Einbildungskraft würde, etwas gedrätig-	https://api.digitale-sammlungen.de/iiif/presentation/v2/bsb10502012/canvas/374/view	ARZNEYGELAHRTHEIT
bsb10502012	00402	95	cher Einbildungskraft und Kunſttrieb gar nichts zu	https://api.digitale-sammlungen.de/iiif/presentation/v2/bsb10502012/canvas/402/view	SCHÖNE KÜNSTE
bsb10502012	00404	36	Gefühle zu wecken, und die Einbildungskraft zu be-	https://api.digitale-sammlungen.de/iiif/presentation/v2/bsb10502012/canvas/404/view	GOTTESGELAHRTHEIT
bsb10502012	00483	58	a) Des Gedächtniſſes u. d. Einbildungskraft,	https://api.digitale-sammlungen.de/iiif/presentation/v2/bsb10502012/canvas/483/view	LITERARISCHE ANZEIGEN
bsb10502012	00497	117	ſchwärmeriſche Einbildungskraft. Dieſe Materien ſind	https://api.digitale-sammlungen.de/iiif/presentation/v2/bsb10502012/canvas/497/view	LITERARISCHE ANZEIGEN
bsb10502012	00498	91	Einbildungskraft, innige Theilnahme an den Schickſalen	https://api.digitale-sammlungen.de/iiif/presentation/v2/bsb10502012/canvas/498/view	LITERARISCHE ANZEIGEN
bsb10502013	00044	77	er in allen dieſen Gegenſtänden für ſeine feurige Einbildungskraft fand; endlich auch auf die kluge Maſsi-	https://api.digitale-sammlungen.de/iiif/presentation/v2/bsb10502013/canvas/44/view	GESCHICHTE
bsb10502013	00055	39	und da mehr nach Einbildungskraft als Urtheil arbei-	https://api.digitale-sammlungen.de/iiif/presentation/v2/bsb10502013/canvas/55/view	VERMISCHTE SCHRIFTEN
bsb10502013	00085	42	und eine feurige Einbildungskraft beſeſſen habe;	https://api.digitale-sammlungen.de/iiif/presentation/v2/bsb10502013/canvas/85/view	GESCHICHTE
bsb10502013	00117	43	: Theorie der Sinnlichkeit; II. der Einbildungskraft;	https://api.digitale-sammlungen.de/iiif/presentation/v2/bsb10502013/canvas/117/view	PHILOSOPHIE
bsb10502013	00130	89	alten Welt, aus der lebhaften Einbildungskraft der	https://api.digitale-sammlungen.de/iiif/presentation/v2/bsb10502013/canvas/130/view	GOTTESGELAHRTHEIT
bsb10502013	00134	57	ſchäftigung der Einbildungskraft? Denken wir uns	https://api.digitale-sammlungen.de/iiif/presentation/v2/bsb10502013/canvas/134/view	GOTTESGELAHRTHEIT
bsb10502013	00139	84	Einbildungskraft anlockender, Beywerke. Das In-	https://api.digitale-sammlungen.de/iiif/presentation/v2/bsb10502013/canvas/139/view	SCHÖNE KÜNSTE
bsb10502013	00149	92	wo freylich Witz, und Einbildungskraft einen wei-	https://api.digitale-sammlungen.de/iiif/presentation/v2/bsb10502013/canvas/149/view	GOTTESGELAHRTHEIT
bsb10502013	00192	43	„krad Laune, eine lebhafte Einbildungskraft und ein	https://api.digitale-sammlungen.de/iiif/presentation/v2/bsb10502013/canvas/192/view	SCHÖNE KÜNSTE
bsb10502013	00219	76	lender, ja ein ſeltner, Mangel an Einbildungskraft	https://api.digitale-sammlungen.de/iiif/presentation/v2/bsb10502013/canvas/219/view	VERMISCHTE SCHRIFTEN
bsb10502013	00220	6	ſche Beobachter, denen eine feurige Einbildungskraft	https://api.digitale-sammlungen.de/iiif/presentation/v2/bsb10502013/canvas/220/view	VERMISCHTE SCHRIFTEN
bsb10502013	00256	20	Stalaktiten ſind, denen die Einbildungskraft eigene	https://api.digitale-sammlungen.de/iiif/presentation/v2/bsb10502013/canvas/256/view	ERDBESCHREIBUNG
bsb10502013	00277	36	viel Gewicht ihnen auch die Einbildungskraft oder	https://api.digitale-sammlungen.de/iiif/presentation/v2/bsb10502013/canvas/277/view	GOTTESGELAHRTHEIT
bsb10502013	00293	52	Gedichte, welche die lebhafteſte Einbildungskraft	https://api.digitale-sammlungen.de/iiif/presentation/v2/bsb10502013/canvas/293/view	LITERARGESCHICHTE
bsb10502013	00351	64	to vorangeſetzt, das der Einbildungskraft des Leſers	https://api.digitale-sammlungen.de/iiif/presentation/v2/bsb10502013/canvas/351/view	VERMISCHTE SCHRIFTEN
bsb10502013	00351	102	in der Ausführung ſich ſeiner Einbildungskraft und	https://api.digitale-sammlungen.de/iiif/presentation/v2/bsb10502013/canvas/351/view	VERMISCHTE SCHRIFTEN
bsb10502013	00371	120	te ein Geiſt von ſo feuriger Einbildungskraft ein ho-	https://api.digitale-sammlungen.de/iiif/presentation/v2/bsb10502013/canvas/371/view	GOTTESGELAHRTHEIT
bsb10502013	00381	60	opfern, die poetiſirende Einbildungskraft ihrer Seits	https://api.digitale-sammlungen.de/iiif/presentation/v2/bsb10502013/canvas/381/view	VERMISCHTE SCHRIFTEN
bsb10502013	00381	68	Nüchternheit der Einbildungskraft; und geht, unter	https://api.digitale-sammlungen.de/iiif/presentation/v2/bsb10502013/canvas/381/view	VERMISCHTE SCHRIFTEN
bsb10502013	00382	16	den Lumpen ſeiner fabelnden Einbildungskraft um-	https://api.digitale-sammlungen.de/iiif/presentation/v2/bsb10502013/canvas/382/view	VERMISCHTE SCHRIFTEN
bsb10502013	00382	28	heit, mit welcher ſich die Einbildungskraft des Vfs.	https://api.digitale-sammlungen.de/iiif/presentation/v2/bsb10502013/canvas/382/view	VERMISCHTE SCHRIFTEN
bsb10502013	00413	94	Einbildungskraft ſelten durch die Geburt geſtiftet	https://api.digitale-sammlungen.de/iiif/presentation/v2/bsb10502013/canvas/413/view	GESCHICHTE
bsb10502013	00425	84	Was die Einbildungskraft des griechiſchen Dichters	https://api.digitale-sammlungen.de/iiif/presentation/v2/bsb10502013/canvas/425/view	PHILOLOGIE
bsb10502013	00494	52	ten Einbildungskraft um ſo mehr ſchmeichelt, je häufiger	https://api.digitale-sammlungen.de/iiif/presentation/v2/bsb10502013/canvas/494/view	LITERARISCHE ANZEIGEN
bsb10502013	00562	89	Einbildungskraft, wie Burke, muſste durch die un-	https://api.digitale-sammlungen.de/iiif/presentation/v2/bsb10502013/canvas/562/view	LITERARISCHE NACHRICHTEN
bsb10502013	00576	33	Leidenden, zu Labung ſeiner getrübten Einbildungskraft Heilung ihrer Krankheiten, werden ihn am meiſten be-	https://api.digitale-sammlungen.de/iiif/presentation/v2/bsb10502013/canvas/576/view	LITERARISCHE ANZEIGEN
bsb10502007	00030	37	ſich dem Gedächtniſſe und der Einbildungskraft noch	https://api.digitale-sammlungen.de/iiif/presentation/v2/bsb10502007/canvas/30/view	KINDERSCHRIFTEN
bsb10502007	00046	36	benen Einbildungskraft liegt. Die jungen ſaliſchen	https://api.digitale-sammlungen.de/iiif/presentation/v2/bsb10502007/canvas/46/view	GESCHICHTE
bsb10502007	00056	25	Gedächtniſs, Einbildungskraft, Talente, Wiſſenſchaf-	https://api.digitale-sammlungen.de/iiif/presentation/v2/bsb10502007/canvas/56/view	PAEDAGOGIK
bsb10502007	00058	94	die Art, wie R's. wolküſtige Einbildungskraft nach S. 1of. ſpielte.	https://api.digitale-sammlungen.de/iiif/presentation/v2/bsb10502007/canvas/58/view	KLEINE SCHRIFTEN
bsb10502007	00076	90	eine erhitzte Einbildungskraft lacht über Diſtinctionen.	https://api.digitale-sammlungen.de/iiif/presentation/v2/bsb10502007/canvas/76/view	PHILOSOPHIE
bsb10502007	00141	38	als Hipparchus, aber von feurigerer Einbildungskraft,	https://api.digitale-sammlungen.de/iiif/presentation/v2/bsb10502007/canvas/141/view	MATHEMATIK
bsb10502007	00170	83	8. 77 Z. 3 Einbildungskraft ſt. Einbildung.	https://api.digitale-sammlungen.de/iiif/presentation/v2/bsb10502007/canvas/170/view	LITERARISCHE ANZEIGEN
bsb10502007	00209	70	- Einbildungskraft. Der Preis iſt 32 ſs. courant. Leſer	https://api.digitale-sammlungen.de/iiif/presentation/v2/bsb10502007/canvas/209/view	LITERARISCHE ANZEIGEN
bsb10502007	00240	7	Darſtellungskraft, wohin Einbildungskraft, Erneue-	https://api.digitale-sammlungen.de/iiif/presentation/v2/bsb10502007/canvas/240/view	PHILOSOPHIE
bsb10502007	00278	33	Eigenliebe, Einbildungskraft und Lebhaftigkeit, oder	https://api.digitale-sammlungen.de/iiif/presentation/v2/bsb10502007/canvas/278/view	ERDBESCHREIBUNG
bsb10502007	00292	99	anders, und ſeine Einbildungskraft nuſs jeden Augen	https://api.digitale-sammlungen.de/iiif/presentation/v2/bsb10502007/canvas/292/view	PHILOLOGIE
bsb10502007	00293	39	der Einbildungskraft der Griechen überhaupt, und ins-	https://api.digitale-sammlungen.de/iiif/presentation/v2/bsb10502007/canvas/293/view	PHILOLOGIE
bsb10502007	00333	26	der Einbildungskraft, oder bloſs ſinnliche Kraft und	https://api.digitale-sammlungen.de/iiif/presentation/v2/bsb10502007/canvas/333/view	SCHÖNE KÜNSTE
bsb10502007	00336	10	zu ſehen, wie Houner ſich hilft, wo er von der Einbildungskraft ſpricht, Od. I, 115.: öoaouéo: rarég'	https://api.digitale-sammlungen.de/iiif/presentation/v2/bsb10502007/canvas/336/view	SCHÖNE KÜNSTE
bsb10502007	00344	42	Ohre und der Einbildungskraft ſchmeicheln? Mit Recht	https://api.digitale-sammlungen.de/iiif/presentation/v2/bsb10502007/canvas/344/view	SCHÖNE KÜNSTE
bsb10502007	00405	23	leiteten Einbildungskraft intereſſant machen zu wollen.	https://api.digitale-sammlungen.de/iiif/presentation/v2/bsb10502007/canvas/405/view	LITERARISCHE ANZEIGEN
bsb10502007	00429	75	innern Sinne. III. Von der Einbildungskraft. 3. 7Men-	https://api.digitale-sammlungen.de/iiif/presentation/v2/bsb10502007/canvas/429/view	LITERARISCHE ANZEIGEN
bsb10502007	00512	123	ördnung wegen unſere Einbildungskraft bey dº 9	https://api.digitale-sammlungen.de/iiif/presentation/v2/bsb10502007/canvas/512/view	NATURGESCHICHTE
bsb10502007	00532	112	gionen der Einbildungskraft? Geben denn die von	https://api.digitale-sammlungen.de/iiif/presentation/v2/bsb10502007/canvas/532/view	VERMISCHTE SCHRIFTEN
bsb10502007	00534	25	noch an lebhafter Einbildungskraft gebreche, das wird	https://api.digitale-sammlungen.de/iiif/presentation/v2/bsb10502007/canvas/534/view	SCHÖNE KÜNSTE
bsb10502007	00609	24	bringung der Muttermahle durch die Einbildungskraft.	https://api.digitale-sammlungen.de/iiif/presentation/v2/bsb10502007/canvas/609/view	LITERARISCHE ANZEIGEN
bsb10541100	00054	83	Licenz, und wollte aun von der Einbildungskraft allein	https://api.digitale-sammlungen.de/iiif/presentation/v2/bsb10541100/canvas/54/view	SCHÖNE KÜNSTE
bsb10541100	00056	24	Einbildungskraft nicht begreifen können, die ſich erlau-	https://api.digitale-sammlungen.de/iiif/presentation/v2/bsb10541100/canvas/56/view	SCHOENE KÜNSTE
bsb10541100	00069	97	fühle, an die crafſeſten Fictionen der Einbildungskraft	https://api.digitale-sammlungen.de/iiif/presentation/v2/bsb10541100/canvas/69/view	ERBAUUNGSSCHRIFTEN
bsb10541100	00107	14	ſerer Sinne und Einbildungskraft ſind, ſind, in ſofern	https://api.digitale-sammlungen.de/iiif/presentation/v2/bsb10541100/canvas/107/view	VERMISCHTE SCHRIFTEN
bsb10541100	00150	41	Einbildungskraft. Ein ſo ſchön geſchriebener als ge-	https://api.digitale-sammlungen.de/iiif/presentation/v2/bsb10541100/canvas/150/view	ARZNEYGELAHRTHEIT
bsb10541100	00178	74	nils, bewandernde, Einbildungskraft, Benutzende, Be-	https://api.digitale-sammlungen.de/iiif/presentation/v2/bsb10541100/canvas/178/view	PAEDAGOGIK
bsb10541100	00178	77	dächtniſs, die Einbildungskraft, die Urtheils- und Beur-	https://api.digitale-sammlungen.de/iiif/presentation/v2/bsb10541100/canvas/178/view	PAEDAGOGIK
bsb10541100	00179	77	rungsvermögen, 2) die Einbildungskraft und das Ver-	https://api.digitale-sammlungen.de/iiif/presentation/v2/bsb10541100/canvas/179/view	PAEDAGOGIK
bsb10541100	00253	122	nur die Lehre von der Sinnlichkeit, Einbildungskraft,	https://api.digitale-sammlungen.de/iiif/presentation/v2/bsb10541100/canvas/253/view	PHILOSOPHIE
bsb10541100	00277	59	zen - mehr für die Einbildungskraft als für den Ver-	https://api.digitale-sammlungen.de/iiif/presentation/v2/bsb10541100/canvas/277/view	FREYMAUREREY
bsb10541100	00305	50	telmäſsige Einbildungskraft führen kann, wird hinrei--	https://api.digitale-sammlungen.de/iiif/presentation/v2/bsb10541100/canvas/305/view	SCHÖNE KÜNSTE
bsb10541100	00306	45	ginale oder vorzügliche Einbildungskraft, welche allein	https://api.digitale-sammlungen.de/iiif/presentation/v2/bsb10541100/canvas/306/view	SCHÖNE KÜNSTE
bsb10541100	00351	24	ſich durch kühne Flüge der Einbildungskraft eine Ideen-	https://api.digitale-sammlungen.de/iiif/presentation/v2/bsb10541100/canvas/351/view	PHILOSOPHIE
bsb10541100	00353	66	theſis der Einbildungskraft. Nun aber heiſst dasjenige,	https://api.digitale-sammlungen.de/iiif/presentation/v2/bsb10541100/canvas/353/view	PHILOSOPHIE
bsb10502039	00145	78	Einbildungskraft in dieſen das Gefühl erſetzen muſs;	https://api.digitale-sammlungen.de/iiif/presentation/v2/bsb10502039/canvas/145/view	LITERARISCHE NACHRICHTEN
bsb10502039	00258	104	ſpielt, nicht bloſs die Phantaſie und Einbildungskraft erregt	https://api.digitale-sammlungen.de/iiif/presentation/v2/bsb10502039/canvas/258/view	KLEINE SCHRIFTEN
bsb10502039	00326	11	die Einbildungskraft, auf die Sinne, auf den Willen,	https://api.digitale-sammlungen.de/iiif/presentation/v2/bsb10502039/canvas/326/view	LITERARISCHE ANZEIGEN
bsb10502011	00059	38	1c. Ueberſpannte Einbildungskraft. Die Phantaſie iſt	https://api.digitale-sammlungen.de/iiif/presentation/v2/bsb10502011/canvas/59/view	ARZNEYGELAHRTHEIT
bsb10502011	00084	17	Senſationen, und den Geſetzen derſelben. Die Einbildungskraft, oder die Fähigkeit des Seelenorgans	https://api.digitale-sammlungen.de/iiif/presentation/v2/bsb10502011/canvas/84/view	ARZNEYGELAHRTHEIT
bsb10502011	00084	26	ſitzen. Die Einbildungskraft hängt von der Fertig-	https://api.digitale-sammlungen.de/iiif/presentation/v2/bsb10502011/canvas/84/view	ARZNEYGELAHRTHEIT
bsb10502011	00084	49	Einbildungskraft, und die Seele erlangt die Fahig-	https://api.digitale-sammlungen.de/iiif/presentation/v2/bsb10502011/canvas/84/view	ARZNEYGELAHRTHEIT
bsb10502011	00084	105	Einbildungskraft können widernatürlich werden.	https://api.digitale-sammlungen.de/iiif/presentation/v2/bsb10502011/canvas/84/view	ARZNEYGELAHRTHEIT
bsb10502011	00085	49	natürlich beſchaffener Einbildungskraft. Die näch-	https://api.digitale-sammlungen.de/iiif/presentation/v2/bsb10502011/canvas/85/view	ARZNEYGELAHRTHEIT
bsb10502011	00151	71	tiſchen, für Herz und Einbildungskraft gleich leeren	https://api.digitale-sammlungen.de/iiif/presentation/v2/bsb10502011/canvas/151/view	SCHÖNE KÜNSTE
bsb10502011	00169	18	von der Einbildungskraft, würde belehrender wer-	https://api.digitale-sammlungen.de/iiif/presentation/v2/bsb10502011/canvas/169/view	PAEDAGOGIK
bsb10502011	00200	68	die Einbildungskraft dazu.	https://api.digitale-sammlungen.de/iiif/presentation/v2/bsb10502011/canvas/200/view	SCHÖNE KÜNSTE
bsb10502011	00200	113	der Einbildungskraft hervorgehen, ſie auch das Höch-	https://api.digitale-sammlungen.de/iiif/presentation/v2/bsb10502011/canvas/200/view	SCHÖNE KÜNSTE
bsb10502011	00201	56	man wird gewahr, daſs ſeine Einbildungskraft ſelbſt	https://api.digitale-sammlungen.de/iiif/presentation/v2/bsb10502011/canvas/201/view	SCHÖNE KÜNSTE
bsb10502011	00207	29	den und Geberden die Einbildungskraft gemeiner	https://api.digitale-sammlungen.de/iiif/presentation/v2/bsb10502011/canvas/207/view	GOTTESGELAHRTHEIT
bsb10502011	00232	84	dächtniſſes und der Einbildungskraft; denn ſie er-	https://api.digitale-sammlungen.de/iiif/presentation/v2/bsb10502011/canvas/232/view	MATHEMATIK
bsb10502011	00262	55	Kreiſe. Er beſitzt bey einigem Grad von Einbildungskraft	https://api.digitale-sammlungen.de/iiif/presentation/v2/bsb10502011/canvas/262/view	KLEINE SCHRIFTEN
bsb10502011	00262	71	S. 8 „indem die geſchaftige Einbildungskraft die Schnee-	https://api.digitale-sammlungen.de/iiif/presentation/v2/bsb10502011/canvas/262/view	KLEINE SCHRIFTEN
bsb10502011	00285	36	IIülſe einer reichen Einbildungskraft zu verſinnlichen,	https://api.digitale-sammlungen.de/iiif/presentation/v2/bsb10502011/canvas/285/view	PHILOSOPHIE
bsb10502011	00313	21	Gegenſtände exaltirte Einbildungskraft, zu ſonder-	https://api.digitale-sammlungen.de/iiif/presentation/v2/bsb10502011/canvas/313/view	ERDBESCHREIBUNG
bsb10502011	00344	59	der glühenden Einbildungskraft des Dichters zu ma»	https://api.digitale-sammlungen.de/iiif/presentation/v2/bsb10502011/canvas/344/view	SCHÖNE KÜNSTE
bsb10502011	00344	107	ſen Einbildungskraft ſich damit begnügen kann, die	https://api.digitale-sammlungen.de/iiif/presentation/v2/bsb10502011/canvas/344/view	SCHÖNE KÜNSTE
bsb10502011	00354	74	„ner lebhaften Einbildungskraft ſich in neuen und	https://api.digitale-sammlungen.de/iiif/presentation/v2/bsb10502011/canvas/354/view	VERMISCHTE SCHRIFTEN
bsb10502011	00528	115	nur werke der Einbildungskraft nährten, zur That skei"	https://api.digitale-sammlungen.de/iiif/presentation/v2/bsb10502011/canvas/528/view	LITERARISCHE ANZEIGEN
bsb10502005	00027	89	Gracle natürlich und täuſchend. Die Einbildungskraft	https://api.digitale-sammlungen.de/iiif/presentation/v2/bsb10502005/canvas/27/view	VERMISCHTE SCHRIFTEN
bsb10502005	00033	80	denheit unuſs er ſeiue Einbildungskraft mit Idealen der	https://api.digitale-sammlungen.de/iiif/presentation/v2/bsb10502005/canvas/33/view	VERMISCHTE SCHRIFTEN
bsb10502005	00035	81	nen, oder alle Werke, woran die Einbildungskraft al-	https://api.digitale-sammlungen.de/iiif/presentation/v2/bsb10502005/canvas/35/view	VERMISCHTE SCHRIFTEN
bsb10502005	00106	19	ckelt werden können. Die Einbildungskraft hatte hier	https://api.digitale-sammlungen.de/iiif/presentation/v2/bsb10502005/canvas/106/view	SCHÖNE KÜNSTE
bsb10502005	00139	25	theil, welchen die Einbildungskraft daran genommen	https://api.digitale-sammlungen.de/iiif/presentation/v2/bsb10502005/canvas/139/view	SCHÖNE KÜNSTE
bsb10502005	00176	52	VVillen zu motivireu, nicht Gefühl und Einbildungskraft	https://api.digitale-sammlungen.de/iiif/presentation/v2/bsb10502005/canvas/176/view	LITERARISCHE ANZEIGEN
bsb10502005	00198	14	ſie ſo vieles enthält, was auf die Einbildungskraft den	https://api.digitale-sammlungen.de/iiif/presentation/v2/bsb10502005/canvas/198/view	LITERARISCHE ANZEIGEN
bsb10502005	00260	32	Schriftſteller von einer ſo warmen und thätigen Einbildungskraft, und bey dem das Beſtreben, allenthal-	https://api.digitale-sammlungen.de/iiif/presentation/v2/bsb10502005/canvas/260/view	GESCHICHTE
bsb10502005	00478	76	die Einbildungskraft vor die Region des Verſtandes bringt; nit	https://api.digitale-sammlungen.de/iiif/presentation/v2/bsb10502005/canvas/478/view	KLEINE SCHRIFTEN
bsb10502005	00480	21	Meiſter über die Einbildungskraft in ihrem Einfluſs	https://api.digitale-sammlungen.de/iiif/presentation/v2/bsb10502005/canvas/480/view	PHILOSOPHIE
bsb10502005	00480	23	der beiden Schriften: Ueber die Einbildungskraft	https://api.digitale-sammlungen.de/iiif/presentation/v2/bsb10502005/canvas/480/view	PHILOSOPHIE
bsb10502005	00480	39	fremde, über den Einfluſs der Einbildungskraft auf	https://api.digitale-sammlungen.de/iiif/presentation/v2/bsb10502005/canvas/480/view	PHILOSOPHIE
bsb10502005	00480	56	aus der Folge der Abſchnitte 1) Beichreibung der Einbildungskraft. 2) Ihr körperlicher Einfluſs. 3) Träume.	https://api.digitale-sammlungen.de/iiif/presentation/v2/bsb10502005/canvas/480/view	PHILOSOPHIE
bsb10502005	00480	58	de der Einbildungskraft. 7) Einbildungskraft in Be-	https://api.digitale-sammlungen.de/iiif/presentation/v2/bsb10502005/canvas/480/view	PHILOSOPHIE
bsb10502005	00480	76	der eine Theorie der Einbildungskraft noch eine voll-	https://api.digitale-sammlungen.de/iiif/presentation/v2/bsb10502005/canvas/480/view	PHILOSOPHIE
bsb10502005	00480	81	Einbildungskraft und eine Menge treffender Bemerkun-	https://api.digitale-sammlungen.de/iiif/presentation/v2/bsb10502005/canvas/480/view	PHILOSOPHIE
bsb10502005	00480	84	unter der Einwirkung der Einbildungskraft ſtehen,	https://api.digitale-sammlungen.de/iiif/presentation/v2/bsb10502005/canvas/480/view	PHILOSOPHIE
bsb10502005	00480	85	enthält. Das wichtige Werk über die Einbildungskraft	https://api.digitale-sammlungen.de/iiif/presentation/v2/bsb10502005/canvas/480/view	PHILOSOPHIE
bsb10502005	00484	71	nicht bloſs von der Stärke der Einbildungskraft abhange.	https://api.digitale-sammlungen.de/iiif/presentation/v2/bsb10502005/canvas/484/view	NATURGESCHICHTE
bsb10502005	00509	81	Spielraum für die Einbildungskraft übrig, und er kann	https://api.digitale-sammlungen.de/iiif/presentation/v2/bsb10502005/canvas/509/view	SCHÖNE KÜNSTE
bsb10502005	00516	22	fsen Macht der Einbildungskraft. Etwas Merkwürdiges	https://api.digitale-sammlungen.de/iiif/presentation/v2/bsb10502005/canvas/516/view	PHILOSOPHIE
bsb10502005	00534	95	rungen hervorbrachte. Die Einbildungskraft ſey nicht ſo wirk-	https://api.digitale-sammlungen.de/iiif/presentation/v2/bsb10502005/canvas/534/view	KLEINE SCHRIFTEN
bsb10502005	00625	29	Meiſter üb. die Einbildungskraft u. ihren Einfluſs	https://api.digitale-sammlungen.de/iiif/presentation/v2/bsb10502005/canvas/625/view	MONATSREGISTER
bsb10502004	00105	68	Grad von Einbildungskraft und Witz; aber jene führt	https://api.digitale-sammlungen.de/iiif/presentation/v2/bsb10502004/canvas/105/view	SCHÖNE KÜNSTE
bsb10502004	00161	26	liſt der Einbildungskraft, als daſs er die Kunſt verſtün-	https://api.digitale-sammlungen.de/iiif/presentation/v2/bsb10502004/canvas/161/view	SCHÖNE KÜNSTE
bsb10502004	00162	69	der Einbildungskraft ſchwangerer Perſonen auf die Ge-	https://api.digitale-sammlungen.de/iiif/presentation/v2/bsb10502004/canvas/162/view	VERMISCHTE SCHRIFTEN
bsb10502004	00210	22	Gemälden für die Einbildungskraft ſeine Zuflucht zu	https://api.digitale-sammlungen.de/iiif/presentation/v2/bsb10502004/canvas/210/view	ERBAUUNGSSCHRIFTEN
bsb10502004	00243	30	ſchen, und die Geſtalten ihrer Einbildungskraft lieber	https://api.digitale-sammlungen.de/iiif/presentation/v2/bsb10502004/canvas/243/view	SCHÖNE KÜNSTE
bsb10502004	00244	26	ben ſeiner Einbildungskraft malt, und neben deren	https://api.digitale-sammlungen.de/iiif/presentation/v2/bsb10502004/canvas/244/view	SCHÖNE KÜNSTE
bsb10502004	00254	108	ſich auf alle Art die Einbildungskraft der Kranken zu erregen,	https://api.digitale-sammlungen.de/iiif/presentation/v2/bsb10502004/canvas/254/view	KLEINE SCHRIFTEN
bsb10502004	00272	14	Witze und der Einbildungskraft, bey hiſtoriſchen Un-	https://api.digitale-sammlungen.de/iiif/presentation/v2/bsb10502004/canvas/272/view	GESCHICHTE
