Volume	Page	Line	KWIC	URL	Column
bsb10502009	00096	67	den Hauptgegenſtand zuvor in der Einbildungskraft	https://api.digitale-sammlungen.de/iiif/presentation/v2/bsb10502009/canvas/96/view	PHILOSOPHIE
bsb10502009	00174	43	dichtenden Einbildungskraft in dieſen Fache hervor	https://api.digitale-sammlungen.de/iiif/presentation/v2/bsb10502009/canvas/174/view	SCHÖNE KÜNSTE
bsb10502009	00187	54	ſchieden die freyen Spiele der Einbildungskraft, wo-	https://api.digitale-sammlungen.de/iiif/presentation/v2/bsb10502009/canvas/187/view	SCHÖNE KÜNSTE
bsb10502009	00198	53	Zeitraum nicht abgekürzt, und die Einbildungskraft	https://api.digitale-sammlungen.de/iiif/presentation/v2/bsb10502009/canvas/198/view	SCHÖNE KÜNSTE
bsb10502009	00215	33	Biegſamkeit, mit der ſich ſeine Einbildungskraft al-	https://api.digitale-sammlungen.de/iiif/presentation/v2/bsb10502009/canvas/215/view	SCHÖNE KÜNSTE
bsb10502009	00216	88	Ines Gefühl; eine Einbildungskraft, woraus ſtarke	https://api.digitale-sammlungen.de/iiif/presentation/v2/bsb10502009/canvas/216/view	SCHÖNE KÜNSTE
bsb10502009	00268	29	thätig für Einbildungskraft und Herz. In dieſer Hin-	https://api.digitale-sammlungen.de/iiif/presentation/v2/bsb10502009/canvas/268/view	VERMISCHTE SCHRIFTEN
bsb10502009	00269	66	gen das Gepräge der erfindenden Einbildungskraft zu	https://api.digitale-sammlungen.de/iiif/presentation/v2/bsb10502009/canvas/269/view	VERMISCHTE SCHRIFTEN
bsb10502009	00340	14	thums ven dem Vf. mit der Einbildungskraft eines	https://api.digitale-sammlungen.de/iiif/presentation/v2/bsb10502009/canvas/340/view	GOTTESGELAHRTHEIT
bsb10502009	00361	80	durch die Einbildungskraft leicht zu faſſendes Gan-	https://api.digitale-sammlungen.de/iiif/presentation/v2/bsb10502009/canvas/361/view	SCHÖNE KÜNSTE
bsb10502009	00533	75	futh uicht. Eben die unerſchöpfliche Einbildungskraft,	https://api.digitale-sammlungen.de/iiif/presentation/v2/bsb10502009/canvas/533/view	LITERARISCHE ANZEIGEN
bsb10502009	00554	96	futh icnt. Eben ae unerſchöpfliche Einbildungskraft,	https://api.digitale-sammlungen.de/iiif/presentation/v2/bsb10502009/canvas/554/view	LITERARISCHE ANZEIGEN
bsb10502008	00053	97	ſeiner Einbildungskraft gänzlich hemmt, und kein GÄ.	https://api.digitale-sammlungen.de/iiif/presentation/v2/bsb10502008/canvas/53/view	PHILOSOPHIE
bsb10502008	00065	22	werden können, für die Einbildungskraft darzuſtellen,	https://api.digitale-sammlungen.de/iiif/presentation/v2/bsb10502008/canvas/65/view	PHILOSOPHIE
bsb10502008	00163	76	ten fällt, welche die Einbildungskraft ergötzen und mit	https://api.digitale-sammlungen.de/iiif/presentation/v2/bsb10502008/canvas/163/view	LITERARISCHE ANZEIGEN
bsb10502008	00254	49	oder daſs die Einbildungskraft die Wichtigkeit des	https://api.digitale-sammlungen.de/iiif/presentation/v2/bsb10502008/canvas/254/view	PHILOSOPHIE
bsb10502008	00281	72	Einbildungskraft, welche alles belebt und ſich immer	https://api.digitale-sammlungen.de/iiif/presentation/v2/bsb10502008/canvas/281/view	SCHÖNE KÜNSTE
bsb10502008	00289	34	frenden Einbildungskraft entfandener Miſsverſtänd-	https://api.digitale-sammlungen.de/iiif/presentation/v2/bsb10502008/canvas/289/view	GOTTESGELAHRHEIT
bsb10502008	00324	76	die Einbildungskraft näher zu unterſuchen. Dadurch wird bey	https://api.digitale-sammlungen.de/iiif/presentation/v2/bsb10502008/canvas/324/view	KLEINE SCHRIFTEN
bsb10502008	00324	107	thig haben wird, die Einbildungskraft vor allem erſt zu UTler-	https://api.digitale-sammlungen.de/iiif/presentation/v2/bsb10502008/canvas/324/view	KLEINE SCHRIFTEN
bsb10502008	00426	117	3) äuſsere Sinne 4) innerer Sinn 5) Einbildungskraft	https://api.digitale-sammlungen.de/iiif/presentation/v2/bsb10502008/canvas/426/view	PHILOSOPHIE
bsb10502008	00427	38	Einbildungskraft, ungeachtet der Vf, ſelbſt S. 327. 2 A.	https://api.digitale-sammlungen.de/iiif/presentation/v2/bsb10502008/canvas/427/view	PHILOSOPHIE
bsb10502008	00427	39	ſagt, es geböre zu den Sinnen und der Einbildungskraft	https://api.digitale-sammlungen.de/iiif/presentation/v2/bsb10502008/canvas/427/view	PHILOSOPHIE
bsb10502008	00427	40	felbſt. Einbildungskraft und Dichtungsvermögen ſind	https://api.digitale-sammlungen.de/iiif/presentation/v2/bsb10502008/canvas/427/view	PHILOSOPHIE
bsb10502008	00428	30	jeitläufigen Abſchnitte. Wº der Einbildungskraft lernt	https://api.digitale-sammlungen.de/iiif/presentation/v2/bsb10502008/canvas/428/view	PHILOSOPHIE
bsb10502008	00428	35	fahrt jan erſt weiter unten § 327 339. daſs die Einbildungskraft noch eine Function habe, nämlich das	https://api.digitale-sammlungen.de/iiif/presentation/v2/bsb10502008/canvas/428/view	PHILOSOPHIE
bsb10502008	00428	37	Äſchen Phantaſie unº Einbildungskraft iſt nicht ange-	https://api.digitale-sammlungen.de/iiif/presentation/v2/bsb10502008/canvas/428/view	PHILOSOPHIE
bsb10502008	00428	44	halten derſelben durch die Einbildungskraft unterſchie-	https://api.digitale-sammlungen.de/iiif/presentation/v2/bsb10502008/canvas/428/view	PHILOSOPHIE
bsb10502008	00477	78	groſser Einbildungskraft und Sonderlichkeit und zu-	https://api.digitale-sammlungen.de/iiif/presentation/v2/bsb10502008/canvas/477/view	LITERARGESCHICHTE
bsb10502008	00495	55	gewiſſe Oratorie, welche auf die Einbildungskraft der	https://api.digitale-sammlungen.de/iiif/presentation/v2/bsb10502008/canvas/495/view	ERBAUUNGSSCHRIFTEN
bsb10502008	00508	51	bloſs in der Einbildungskraft des Poeten haben. Wenn	https://api.digitale-sammlungen.de/iiif/presentation/v2/bsb10502008/canvas/508/view	GESCHICHTE
bsb10502008	00560	78	Hand werden die zarten Geſchöpfe der Einbildungskraft,	https://api.digitale-sammlungen.de/iiif/presentation/v2/bsb10502008/canvas/560/view	LITERARISCHE ANZEIGEN
bsb10502008	00560	86	als freyes Spiel der idealiſirenden Einbildungskraft ſich	https://api.digitale-sammlungen.de/iiif/presentation/v2/bsb10502008/canvas/560/view	LITERARISCHE ANZEIGEN
bsb10502008	00606	48	berſpannte Einbildungskraft – Krankheitseinbildung -	https://api.digitale-sammlungen.de/iiif/presentation/v2/bsb10502008/canvas/606/view	LITERARISCHE ANZEIGEN
bsb10502008	00649	164	L. üb. d. Einbildungskraft. I, 651-	https://api.digitale-sammlungen.de/iiif/presentation/v2/bsb10502008/canvas/649/view	REGISTER REGISTER REGISTER
bsb10502008	00662	18	Einbildungskraft, Geſetz derſelb. 1. 62-	https://api.digitale-sammlungen.de/iiif/presentation/v2/bsb10502008/canvas/662/view	REGISTER REGISTER REGISTER
bsb10502020	00101	18	ten; und.wenn feurige Einbildungskraft, die fie in	https://api.digitale-sammlungen.de/iiif/presentation/v2/bsb10502020/canvas/101/view	SCHÖNE KÜNSTE
bsb10502020	00330	61	Rec. keinc Einbildungskraft kennt, die Gedanken er-	https://api.digitale-sammlungen.de/iiif/presentation/v2/bsb10502020/canvas/330/view	GOTTESGELAHRTHEIT
bsb10502020	00336	103	der unsere Einbildungskraft beschäftigen ; — Situatio-	https://api.digitale-sammlungen.de/iiif/presentation/v2/bsb10502020/canvas/336/view	SCHÖNE KÜNSTE
bsb10502020	00507	77	Und ſo wie die Freyheit ſeiner Einbildungskraft allzu	https://api.digitale-sammlungen.de/iiif/presentation/v2/bsb10502020/canvas/507/view	SCHÖNE KÜNSTE
bsb10502020	00512	19	und seine Einbildungskraft triuinphirt keineswegs	https://api.digitale-sammlungen.de/iiif/presentation/v2/bsb10502020/canvas/512/view	SCHÖNE KÜNSTE
bsb10502020	00513	14	die Einbildungskraft kalt und leer. Was könnte	https://api.digitale-sammlungen.de/iiif/presentation/v2/bsb10502020/canvas/513/view	SCHÖNE KÜNSTE
bsb10502020	00513	76	Gefühls und ſeiner Einbildungskraft mit Beſonnen-	https://api.digitale-sammlungen.de/iiif/presentation/v2/bsb10502020/canvas/513/view	SCHÖNE KÜNSTE
bsb10502020	00528	96	schránkung der Einbildungskraft durch sich selbst.	https://api.digitale-sammlungen.de/iiif/presentation/v2/bsb10502020/canvas/528/view	VERMISCHTE SCHRIFTEN
bsb10502020	00529	19	productive.) Einbildungskraft, von auſsen her, durch	https://api.digitale-sammlungen.de/iiif/presentation/v2/bsb10502020/canvas/529/view	VERMISCHTE SCHRIFTEN
bsb10502020	00529	73	durch Worte fahren laſſen, und vermittelſt der Einbildungskraft denjenigen Vorrath von Sätzen durch-	https://api.digitale-sammlungen.de/iiif/presentation/v2/bsb10502020/canvas/529/view	VERMISCHTE SCHRIFTEN
bsb10502020	00529	76	nicht die Einbildungskraft, die uns iur ein Piriſche	https://api.digitale-sammlungen.de/iiif/presentation/v2/bsb10502020/canvas/529/view	VERMISCHTE SCHRIFTEN
bsb10502020	00529	80	Wiedererinnerns. Die Einbildungskraft kann auca	https://api.digitale-sammlungen.de/iiif/presentation/v2/bsb10502020/canvas/529/view	VERMISCHTE SCHRIFTEN
bsb10502020	00529	86	fahrt der Vf. fort, unſere Einbildungskraft alles, was	https://api.digitale-sammlungen.de/iiif/presentation/v2/bsb10502020/canvas/529/view	VERMISCHTE SCHRIFTEN
bsb10502020	00529	95	ſo beſchränke die Einbildungskraft das von ihr zu-	https://api.digitale-sammlungen.de/iiif/presentation/v2/bsb10502020/canvas/529/view	VERMISCHTE SCHRIFTEN
bsb10502020	00529	102	der Einbildungskraft durch ſich ſelbſt. (Man ſieht von	https://api.digitale-sammlungen.de/iiif/presentation/v2/bsb10502020/canvas/529/view	VERMISCHTE SCHRIFTEN
bsb10502020	00529	103	ſelbſt, wie vieles in der Einbildungskraft, nach un-	https://api.digitale-sammlungen.de/iiif/presentation/v2/bsb10502020/canvas/529/view	VERMISCHTE SCHRIFTEN
bsb10502020	00545	46	den Einbildungskraft, wobey für die Forin ganz	https://api.digitale-sammlungen.de/iiif/presentation/v2/bsb10502020/canvas/545/view	SCHÖNE KÜNSTE
bsb10502020	00551	45	keit und der thàtigsten Einbildungskraft, ihm nur im-	https://api.digitale-sammlungen.de/iiif/presentation/v2/bsb10502020/canvas/551/view	GESCHICHTE
bsb10502034	00057	33	die Täuſchungen der Einbildungskraft durch Geſpen-	https://api.digitale-sammlungen.de/iiif/presentation/v2/bsb10502034/canvas/57/view	VERMISCHTE SCHRIFTEN
bsb10502034	00290	79	len, welche die lebhafte Einbildungskraft der Kinder	https://api.digitale-sammlungen.de/iiif/presentation/v2/bsb10502034/canvas/290/view	JUGENDSCHRIFTEN
bsb10502034	00407	95	dem Gedächtniſſe, der Einbildungskraft, dem mora-	https://api.digitale-sammlungen.de/iiif/presentation/v2/bsb10502034/canvas/407/view	LITERARISCHE NACHRICHTEN
bsb10502034	00485	86	a) Gedächtniſs; b) Willkür ; c) Einbildungskraft.	https://api.digitale-sammlungen.de/iiif/presentation/v2/bsb10502034/canvas/485/view	PHILOSOPHIE
bsb10502034	00546	7	Raum, aus der productiven Einbildungskraft hervor-	https://api.digitale-sammlungen.de/iiif/presentation/v2/bsb10502034/canvas/546/view	PHILOSOPHIE
bsb10502022	00095	10	In Perioden, wo die Einbildungskraft über die Ver-	https://api.digitale-sammlungen.de/iiif/presentation/v2/bsb10502022/canvas/95/view	GESCHICHTE
bsb10502022	00166	13	die Sinne und die Einbildungskraft für ihn Schädliches	https://api.digitale-sammlungen.de/iiif/presentation/v2/bsb10502022/canvas/166/view	LITERARISCHE NACHRICHTEN
bsb10502022	00334	68	genſtandes durch die Einbildungskraft; die Gegner	https://api.digitale-sammlungen.de/iiif/presentation/v2/bsb10502022/canvas/334/view	PHILOSOPHIE
bsb10502022	00334	70	aus der Einbildungskraft. Der Aufſatz: Ueber einige	https://api.digitale-sammlungen.de/iiif/presentation/v2/bsb10502022/canvas/334/view	PHILOSOPHIE
bsb10502022	00434	22	Nahrung für das Gefühl und die Einbildungskraft, doch	https://api.digitale-sammlungen.de/iiif/presentation/v2/bsb10502022/canvas/434/view	LITERARISCHE NACHRICHTEN
bsb10502022	00434	94	Fragmente der G-dicite über die Einbildungskraft und	https://api.digitale-sammlungen.de/iiif/presentation/v2/bsb10502022/canvas/434/view	LITERARISCHE NACHRICHTEN
bsb10502022	00468	42	die reichſte Fülle von Geiſt und Einbildungskraft ent-	https://api.digitale-sammlungen.de/iiif/presentation/v2/bsb10502022/canvas/468/view	SCHÖNE KÜNSTE
bsb10502022	00553	71	können, wenn er ſeine Einbildungskraft durch das	https://api.digitale-sammlungen.de/iiif/presentation/v2/bsb10502022/canvas/553/view	VERMISCHTE SCHRIFTEN
bsb10502022	00554	43	che, und was die Einbildungskraft entflammt, nicht	https://api.digitale-sammlungen.de/iiif/presentation/v2/bsb10502022/canvas/554/view	VERMISCHTE SCHRIFTEN
bsb10502022	00554	47	Einbildungskraft entgegenzuſetzen. Das methodi-	https://api.digitale-sammlungen.de/iiif/presentation/v2/bsb10502022/canvas/554/view	VERMISCHTE SCHRIFTEN
bsb10502022	00554	49	kein zweckmäſsiges Mittel, die Einbildungskraft zu	https://api.digitale-sammlungen.de/iiif/presentation/v2/bsb10502022/canvas/554/view	VERMISCHTE SCHRIFTEN
bsb10502022	00591	70	bare Einbildungskraft zeigt.	https://api.digitale-sammlungen.de/iiif/presentation/v2/bsb10502022/canvas/591/view	LITERARISCHE NACHRICHTEN
bsb10502022	00598	80	machte, und von lebhafter Einbildungskraft. Seine	https://api.digitale-sammlungen.de/iiif/presentation/v2/bsb10502022/canvas/598/view	LITERARISCHE NACHRICHTEN
bsb10502022	00600	30	war die Einbildungskraft dem Verſtande überlegen;	https://api.digitale-sammlungen.de/iiif/presentation/v2/bsb10502022/canvas/600/view	LITERARISCHE NACHRICHTEN
bsb10502022	00609	21	derung der Entwürfe einer feurigen Einbildungskraft	https://api.digitale-sammlungen.de/iiif/presentation/v2/bsb10502022/canvas/609/view	LITERARISCHE NACHRICHTEN
bsb10502022	00632	43	durch die Einbildungskraft. Zweyte unveränderte	https://api.digitale-sammlungen.de/iiif/presentation/v2/bsb10502022/canvas/632/view	LITERARISCHE ANZEIGEN
bsb10502022	00634	106	ner feurigen Einbildungskraft zeugt, die bey mehrerer	https://api.digitale-sammlungen.de/iiif/presentation/v2/bsb10502022/canvas/634/view	LITERARISCHE NACHRICHTEN
bsb10502036	00433	10	Akinſide's Vergnügungen der Einbildungskraft.	https://api.digitale-sammlungen.de/iiif/presentation/v2/bsb10502036/canvas/433/view	SCHÖNE KÜNSTE
bsb10502036	00434	122	Die zarten Künſte der Einbildungskraft –	https://api.digitale-sammlungen.de/iiif/presentation/v2/bsb10502036/canvas/434/view	SCHÖNE KÜNSTE
bsb10502036	00485	69	So z. B. bey den Italiänern Einbildungskraft und	https://api.digitale-sammlungen.de/iiif/presentation/v2/bsb10502036/canvas/485/view	PHILOSOPHIE
bsb10541084	00054	73	führeriſch, und der Einbildungskraft mancher Le-	https://api.digitale-sammlungen.de/iiif/presentation/v2/bsb10541084/canvas/54/view	SCHOENE WISSENSCHAFTEN
bsb10541084	00171	48	les einſeitig nimmt, um die Einbildungskraft in	https://api.digitale-sammlungen.de/iiif/presentation/v2/bsb10541084/canvas/171/view	ARZNEYGELAHRTHEIT
bsb10541084	00209	69	„beide fürs Aufreizen der Einbildungskraft mit	https://api.digitale-sammlungen.de/iiif/presentation/v2/bsb10541084/canvas/209/view	SCHOENE KÜNSTE
bsb10541084	00311	56	ein freyes Spiel der Einbildungskraft als ein Ge-	https://api.digitale-sammlungen.de/iiif/presentation/v2/bsb10541084/canvas/311/view	SCHOENE WISSENSCHAFTEN
bsb10541084	00312	55	nen; die Einbildungskraft, und das Gefühl“ und	https://api.digitale-sammlungen.de/iiif/presentation/v2/bsb10541084/canvas/312/view	SCHOENE WISSENSCHAFTEN
bsb10541084	00313	60	Beſchäftigung der Einbildungskraft ankomme,	https://api.digitale-sammlungen.de/iiif/presentation/v2/bsb10541084/canvas/313/view	SCHOENE WISSENSCHAFTEN
bsb10541084	00313	62	die Einbildungskraft zu beſchäftigen hat, ſich nur	https://api.digitale-sammlungen.de/iiif/presentation/v2/bsb10541084/canvas/313/view	SCHOENE WISSENSCHAFTEN
bsb10502037	00039	44	ſo vermag die Einbildungskraft die gewonnenen Vor-	https://api.digitale-sammlungen.de/iiif/presentation/v2/bsb10502037/canvas/39/view	PÄDAGOGIK
bsb10502037	00039	46	Einbildungskraft verarbeitet geiſtig die Sinnenein-	https://api.digitale-sammlungen.de/iiif/presentation/v2/bsb10502037/canvas/39/view	PÄDAGOGIK
bsb10502037	00039	47	Einbildungskraft verarbeitet geiſtig die Sinneneindrücke vermittelſt der Gedächtniſſe, und je mehr	https://api.digitale-sammlungen.de/iiif/presentation/v2/bsb10502037/canvas/39/view	PÄDAGOGIK
bsb10502037	00066	73	der in ſeiner Weisheit den Plan entwarf, von der Einbildungskraft nicht gehörig unterſtützt wurde. –	https://api.digitale-sammlungen.de/iiif/presentation/v2/bsb10502037/canvas/66/view	SCHÖNE KÜNSTE
bsb10502037	00272	68	für die Einbildungskraft und das Herz der Jugend.	https://api.digitale-sammlungen.de/iiif/presentation/v2/bsb10502037/canvas/272/view	JUGENDSCHRIFTEN
bsb10502037	00286	16	Einbildungskraft) Fähigkeiten zugleich zu üben.	https://api.digitale-sammlungen.de/iiif/presentation/v2/bsb10502037/canvas/286/view	PÄDAGOGIK
bsb10502037	00494	12	ihrer glühenden und romantiſchen Einbildungskraft	https://api.digitale-sammlungen.de/iiif/presentation/v2/bsb10502037/canvas/494/view	VERMISCHTE SCHRIFTEN
bsb10502037	00543	78	der franzöſiſchen Comödie bediente. Eine feurige Einbildungskraft und die Schnelligkeit der glücklichſten	https://api.digitale-sammlungen.de/iiif/presentation/v2/bsb10502037/canvas/543/view	LITERARISCHE NACHRICHTEN
bsb10502037	00543	89	der Einbildungskraft; und wenn jener am Abend ei-	https://api.digitale-sammlungen.de/iiif/presentation/v2/bsb10502037/canvas/543/view	LITERARISCHE NACHRICHTEN
bsb10502037	00544	48	genug für ſeine Beſchäfftigung und eine zu feurige Einbildungskraft. Seine beſten Arbeiten ſind: allegoriſche	https://api.digitale-sammlungen.de/iiif/presentation/v2/bsb10502037/canvas/544/view	LITERARISCHE NACHRICHTEN
bsb10502023	00055	53	Einbildungskraft, welche ſinnliche Bilder vereinigt,	https://api.digitale-sammlungen.de/iiif/presentation/v2/bsb10502023/canvas/55/view	LITERATURGESCHICHTE
bsb10502023	00069	50	Wenig Anziehendes für die Einbildungskraft; die Be-	https://api.digitale-sammlungen.de/iiif/presentation/v2/bsb10502023/canvas/69/view	GESCHICHTE
bsb10502023	00107	63	Einbildungskraft als ſein Nachdenken beſchäftigen;	https://api.digitale-sammlungen.de/iiif/presentation/v2/bsb10502023/canvas/107/view	GESCHICHTE
bsb10502023	00185	82	ftudiert zu haben, ſich ſeiner Einbildungskraft hinge-	https://api.digitale-sammlungen.de/iiif/presentation/v2/bsb10502023/canvas/185/view	LITERARISCHE NACHRICHTEN
bsb10502023	00295	37	tellectuelle, beſonders Witz und Einbildungskraft, mehr	https://api.digitale-sammlungen.de/iiif/presentation/v2/bsb10502023/canvas/295/view	VERMISCHTE SCHRIFTEN
bsb10502023	00457	46	Herzens, der Einbildungskraft und des Schönheits-	https://api.digitale-sammlungen.de/iiif/presentation/v2/bsb10502023/canvas/457/view	PAEDAGOGIK
bsb10502023	00499	63	ren Gegenſtand ſelbſt vermöge der Einbildungskraft	https://api.digitale-sammlungen.de/iiif/presentation/v2/bsb10502023/canvas/499/view	MATHEMATIK
bsb10502023	00518	12	bigen Zeit, wo ſie durch die Einbildungskraft der	https://api.digitale-sammlungen.de/iiif/presentation/v2/bsb10502023/canvas/518/view	VERMISCHTE SCHRIFTEN
bsb10502023	00522	7	jenen Bewegungen der Einbildungskraft, wenn ſie	https://api.digitale-sammlungen.de/iiif/presentation/v2/bsb10502023/canvas/522/view	VERMISCHTE SCHRIFTEN
bsb10502023	00561	45	langt, daſs er in ſeiner Einbildungskraft die verſchie-	https://api.digitale-sammlungen.de/iiif/presentation/v2/bsb10502023/canvas/561/view	VERMISCHTE SCHRIFTEN
bsb10502027	00064	73	heit ſeiner Einbildungskraft zeigen, dieſelbe Sache	https://api.digitale-sammlungen.de/iiif/presentation/v2/bsb10502027/canvas/64/view	PHILOSOPHIE
bsb10502027	00142	7	„und Treibens ſeiner Einbildungskraft bewuſst iſt,	https://api.digitale-sammlungen.de/iiif/presentation/v2/bsb10502027/canvas/142/view	LITERATURGESCHICHTE
bsb10502027	00142	23	„Einbildungskraft. Auf ihren Flügeln ſchwebt Böh-	https://api.digitale-sammlungen.de/iiif/presentation/v2/bsb10502027/canvas/142/view	LITERATURGESCHICHTE
bsb10502027	00142	54	„entflammte Einbildungskraft beſtimmt den Charak-	https://api.digitale-sammlungen.de/iiif/presentation/v2/bsb10502027/canvas/142/view	LITERATURGESCHICHTE
bsb10502027	00305	64	herigen Metaphyſiken und Logiken von allen Einfluſs des Sinnlichen und der Einbildungskraft gerei-	https://api.digitale-sammlungen.de/iiif/presentation/v2/bsb10502027/canvas/305/view	PHILOSOPHIE
bsb10502027	00365	99	dadurch den Vortheil, daſs ſeine Einbildungskraft	https://api.digitale-sammlungen.de/iiif/presentation/v2/bsb10502027/canvas/365/view	ERDBESCHREIBUNG
bsb10502027	00421	64	Müller, J. J., über den Einfluſs der Einbildungskraft nieurkapitain. Mit Kupf. 8. geheftet, auf Druck-	https://api.digitale-sammlungen.de/iiif/presentation/v2/bsb10502027/canvas/421/view	LITERARISCHE ANZEIGEN
bsb10502027	00485	8	iſt ein bloſses Spiel der Einbildungskraft. Der Geiſt	https://api.digitale-sammlungen.de/iiif/presentation/v2/bsb10502027/canvas/485/view	PHILOSOPHIE
bsb10502027	00493	97	dichte, welche bloſs Producte der ſpielenden Einbildungskraft ſind, oder zu nahe an der Gränze	https://api.digitale-sammlungen.de/iiif/presentation/v2/bsb10502027/canvas/493/view	SCHÖNE KÜNSTE
bsb10502027	00493	107	ben durch die Einbildungskraft Leben errheilen	https://api.digitale-sammlungen.de/iiif/presentation/v2/bsb10502027/canvas/493/view	SCHÖNE KÜNSTE
bsb10502027	00569	86	der Einbildungskraft, ſondern auch des Verſtandes	https://api.digitale-sammlungen.de/iiif/presentation/v2/bsb10502027/canvas/569/view	SCHÖNE KÜNSTE
bsb10502027	00667	42	TEinbildungskraft zeigt: ſo ſteht man bald, daſs er auch	https://api.digitale-sammlungen.de/iiif/presentation/v2/bsb10502027/canvas/667/view	LITERARISCHE NACHRICHTEN
bsb10502033	00021	37	ten, daſs nur die Einbildungskraft des Zuſchauers	https://api.digitale-sammlungen.de/iiif/presentation/v2/bsb10502033/canvas/21/view	SCHÖNE KÜNSTE
bsb10502033	00247	100	Einbildungskraft, nicht in der Ausführung, neben	https://api.digitale-sammlungen.de/iiif/presentation/v2/bsb10502033/canvas/247/view	SCHÖNE KÜNSTE
bsb10502033	00285	19	„iſt unſere Einbildungskraft. Die Einbildungskraft	https://api.digitale-sammlungen.de/iiif/presentation/v2/bsb10502033/canvas/285/view	PHYSIK
bsb10502033	00304	83	in der Einbildungskraft deutlich vor ſich ſtehen ſieht,	https://api.digitale-sammlungen.de/iiif/presentation/v2/bsb10502033/canvas/304/view	NATURGESCHICHTE
bsb10502033	00364	86	und alles Feuer der Einbildungskraft der Schriftſtel-	https://api.digitale-sammlungen.de/iiif/presentation/v2/bsb10502033/canvas/364/view	LITERARISCHE NACHRICHTEN
bsb10502033	00463	78	Theorie der Einbildungskraft eröffnet wurde, ſo das	https://api.digitale-sammlungen.de/iiif/presentation/v2/bsb10502033/canvas/463/view	PHILOSOPHIE
bsb10502033	00463	83	Nachdem er die Einbildungskraft ſowohl als Vermö-	https://api.digitale-sammlungen.de/iiif/presentation/v2/bsb10502033/canvas/463/view	PHILOSOPHIE
bsb10502033	00463	88	der, die Einbildungskraft im weitern Sinne oder das	https://api.digitale-sammlungen.de/iiif/presentation/v2/bsb10502033/canvas/463/view	PHILOSOPHIE
bsb10502033	00463	90	ſprünglicher, die Einbildungskraft im engern Sinne,	https://api.digitale-sammlungen.de/iiif/presentation/v2/bsb10502033/canvas/463/view	PHILOSOPHIE
bsb10502033	00463	93	letzte wiederholende Einbildungskraft, deren Reprodu-	https://api.digitale-sammlungen.de/iiif/presentation/v2/bsb10502033/canvas/463/view	PHILOSOPHIE
bsb10502033	00463	98	reproductive Einbildungskraft weiter in Aſſociations-	https://api.digitale-sammlungen.de/iiif/presentation/v2/bsb10502033/canvas/463/view	PHILOSOPHIE
bsb10502033	00464	9	vielmehr zu der productiven Einbildungskraft ge-	https://api.digitale-sammlungen.de/iiif/presentation/v2/bsb10502033/canvas/464/view	PHILOSOPHIE
bsb10502033	00464	28	Die reproductive Einbildungskraft ſtellt der Vf, durch	https://api.digitale-sammlungen.de/iiif/presentation/v2/bsb10502033/canvas/464/view	PHILOSOPHIE
bsb10502033	00464	35	nen des Bewuſstſeyns von den Vorſtellungen der Einbildungskraft wird man den fein zergliedernden	https://api.digitale-sammlungen.de/iiif/presentation/v2/bsb10502033/canvas/464/view	PHILOSOPHIE
bsb10502033	00464	38	Ä nach der Auflöſung der Einbildungskraft in meh-	https://api.digitale-sammlungen.de/iiif/presentation/v2/bsb10502033/canvas/464/view	PHILOSOPHIE
bsb10502033	00464	43	höherer Vermögen auf die Einbildungskraft; wie	https://api.digitale-sammlungen.de/iiif/presentation/v2/bsb10502033/canvas/464/view	PHILOSOPHIE
bsb10502033	00475	66	der Einbildungskraft alles möglich iſt; ſie ſind die	https://api.digitale-sammlungen.de/iiif/presentation/v2/bsb10502033/canvas/475/view	PHYSIK
bsb10502033	00492	104	in einen Traum der Einbildungskraft verliebt, noch	https://api.digitale-sammlungen.de/iiif/presentation/v2/bsb10502033/canvas/492/view	GESCHICHTE
bsb10502033	00653	81	ner kühnen empfindungsreichen Einbildungskraft im	https://api.digitale-sammlungen.de/iiif/presentation/v2/bsb10502033/canvas/653/view	LITERARISCHE ANZEIGEN
bsb10541081	00103	64	da wohl nicht ein Trunk die Einbildungskraft	https://api.digitale-sammlungen.de/iiif/presentation/v2/bsb10541081/canvas/103/view	RECHTSGELAHRTHEIT
bsb10541081	00197	77	Einbildungskraft gehören, u. daſs das Erhabene der	https://api.digitale-sammlungen.de/iiif/presentation/v2/bsb10541081/canvas/197/view	SCHOENE WISSENSCHAFTEN
bsb10541081	00202	99	„meine Einbildungskraft. Aber vor allem – – –jdj	https://api.digitale-sammlungen.de/iiif/presentation/v2/bsb10541081/canvas/202/view	KLEINE SCHRIFTEN
bsb10541081	00247	24	Einbildungskraft dabey intereſürt werden ſollen.	https://api.digitale-sammlungen.de/iiif/presentation/v2/bsb10541081/canvas/247/view	GOTTESGELAHRTHEIT
bsb10541081	00253	88	mente, und feiner feurigen Einbildungskraft, die	https://api.digitale-sammlungen.de/iiif/presentation/v2/bsb10541081/canvas/253/view	ERBAUUNGSSCHRIFTEN
bsb10541081	00282	9	der Arzt ſeiner Einbildungskraft, und ſchmiedet	https://api.digitale-sammlungen.de/iiif/presentation/v2/bsb10541081/canvas/282/view	ARZNEYGELAHRTHEIT
bsb10541081	00321	12	mit einer ſehr lebhaften Einbildungskraft verfaſ-	https://api.digitale-sammlungen.de/iiif/presentation/v2/bsb10541081/canvas/321/view	VERMISCHTE SCHRIFTEN
bsb10541081	00327	89	darunter einen hohen Grad von Einbildungskraft	https://api.digitale-sammlungen.de/iiif/presentation/v2/bsb10541081/canvas/327/view	VERMISCHTE SCHRIFTEN
