bsb10501989_00230_87	1791	3	00230	ARZNEYGELAHRTHEIT	88	https://api.digitale-sammlungen.de/iiif/presentation/v2/bsb10501989/canvas/230/view	Im erſtern will der Vf., daſs man Wahnſinnige durch Erregung anderer Ideen in ihrer Seele nicht zerſtreuen ſoll, weil dieſes am meiſten durch Erhöhung der Einbildungskraft geſchehen könne, die übrigen Seelenkräfte aber erniedrigt werden, wenn eine einzelne zu ſehr angeſpannt wird.
bsb10502067_00133_15	1817	2	00133	GESCHICHTE	16	https://api.digitale-sammlungen.de/iiif/presentation/v2/bsb10502067/canvas/133/view	Ihre Farbe iſt echt Franzöſiſch, und der Ruhmliebe und kriegeriſchen Einbildungskraft dieſes Volkes ſchmeichelnd.
bsb10541100_00351_23	1794	4	00351	PHILOSOPHIE	24	https://api.digitale-sammlungen.de/iiif/presentation/v2/bsb10541100/canvas/351/view	Da aber Köpfe von der Art vorzüglich in Gefahr ſind, ſich durch kühne Flüge der Einbildungskraft eine Ideenwelt zu ſchaffen, und hierdurch die Nutzbarkeit ihrer Talente ſelbſt zu hindern; ſo iſt es Recenſentenpflicht, bey Beurtheilung ihrer Schriften deſto weniger nachſehend zu ſeyn.
bsb10502031_00030_47	1803	3	00030	PHILOSOPHIE	48	https://api.digitale-sammlungen.de/iiif/presentation/v2/bsb10502031/canvas/30/view	Wie kömmt denn der Vf. dazu, darum, weil es äſthetiſche aus der Einbildungskraft entſpringende Ideen giebt, es für möglich zu halten, daſs auch die Vernunftideen und Vernunftgeſetze ihren Urſprung aus jenem Vermögen der ſinnlichen Anſchauung genommen hätten?
bsb10501975_00015_110	1788	1	00015	PHILOSOPHIE	111	https://api.digitale-sammlungen.de/iiif/presentation/v2/bsb10501975/canvas/15/view	Nach einigen ſehr guten Erläuterungen der Behauptung, daſs Glauben das Element aller menſchlichen Erkenntniſs ſey, folgt (S. 153) ein Seitenblick auf diejenige Theorie des Raumes und der Zeit, dadurch ſie für urſprüngliche Formen der Denkkraft, und ſinnliche Anſchauungen, die ohne vorhergehende Erfahrungen dem menſchlichen Geiſte beywohnen, erklärt werden- Theophron erklärt dieſes für Phantomen der Einbildungskraft und Anſchauungen des Nichts; eine Erklärung, die ſich nicht allzuwohl reimen, ja kaum verſtehen läſst.
bsb10502089_00318_35	1823	5	00318	GESCHICHTE	36	https://api.digitale-sammlungen.de/iiif/presentation/v2/bsb10502089/canvas/318/view	Ein Gefühl haben wir freylich, daſs es beſtimmte Verhältniſſe der Seelenkräfte giebt: ein Maaſs des Gedächtniſſes, und gleichzeitiger Vorſtellungen; eine Grenze für die Combinationen der Einbildungskraft, ein Ziel des Idealiſirens, eine letzte Geſchwindigkeit des Denkens; da aber Jeder ſich doch darüber von ſich ſelbſt am beſten Rechenſchaft geben kann, und es nur unvollſtändig zu thun vermag, ſeine eigene Seele ihm immerfort Geheimniſs bleibt; ſo wird es mit den Vergleichungen wohl nimmer glücken.
bsb10628808_00015_20	1793	3	00015	PHILOSOPHIE	21	https://api.digitale-sammlungen.de/iiif/presentation/v2/bsb10628808/canvas/15/view	Es iſt ein gemeinſchaftlicher Sinn (Senſus communis, nicht vulgaris) in wie ferne dasjenige, was durch ihn gefühlt wird, ſeiner Möglichkeit nach in der a priori beſtimmten Harmonie zwiſchen Einbildungskraft und Verſtand gegründet, und alſo in ſo ferne jedermann mittheilbar iſt.
bsb10502065_00418_94	1816	4	00418	SCHÖNE KÜNSTE	95	https://api.digitale-sammlungen.de/iiif/presentation/v2/bsb10502065/canvas/418/view	Nach ihm gehört zur Empfindung des Schönen: Bewuſstſeyn, Erinnerungskraft (nur leiſe wirkſam), Verſtand (als Erkenntniſsvermögen der Einheit in der Mannichfaltigkeit, die aber nicht immer äſthetiſch iſt), vorzüglich Einbildungskraft, die er lieber in äſthetiſcher Hinſicht Phantaſie nennen wolle, (eine Benennung, die uns die der Willkür unterworfene Einbildungskraft nicht von der unwillkürlichen Thätigkeit denſelben ſo ſcharf zu unterſcheiden ſcheint, als die Benennung: Imagination).
bsb10502062_00041_51	1816	1	00041	GESCHICHTE	52	https://api.digitale-sammlungen.de/iiif/presentation/v2/bsb10502062/canvas/41/view	„Ich fürchte, ſagt der Ueberſetzer, daſs L. den Werth der Predigten zu gering achtet, und die ſinnliche Erregung der Einbildungskraft beym Gottesdienſt für wichtiger hält als ſie iſt; Hauptſache bleibt immer die Aufregung des innern ſittlichen Menſchen, daſs er inne werde, er ſey Bürger einer freyen Geiſterwelt unter der Regierung eines heiligen Geſetzgebers, eines gütigen Vaters und eines gerechten Richters.“
bsb10502008_00426_116	1796	4	00426	PHILOSOPHIE	117	https://api.digitale-sammlungen.de/iiif/presentation/v2/bsb10502008/canvas/426/view	5) Einbildungskraft
bsb10502022_00468_41	1801	2	00468	SCHÖNE KÜNSTE	42	https://api.digitale-sammlungen.de/iiif/presentation/v2/bsb10502022/canvas/468/view	Bey einer völligen Unbekanntſchaft mit dem claſſiſchen Alterthume, die ſich bis in die Erfindung und Orthographie der Namen zeigt, und bey einem gänzlichen Mangel an Sinn für den Geiſt deſſelben, eine Geſchichte zu ſchreiben, welche durchgängig auf claſſiſchem Boden ſpielt, iſt eine Kühnheit, die nur durch die reichſte Fülle von Geiſt und Einbildungskraft entſchuldigt und vergeſſen gemacht werden könnte.
bsb10502060_00330_116	1815	3	00330	SCHÖNE KÜNSTE	117	https://api.digitale-sammlungen.de/iiif/presentation/v2/bsb10502060/canvas/330/view	Aber alle dieſe bunten Spiele der Einbildungskraft vermögen nicht das Gemüth zu einem lebendigen Intereſſe zu erwärmen, weil ſie einander nicht nach dem Geſetz künſtleriſcher Zweckmäſsigkeit bedingen, und für ihr Daſeyn gerade in dieſer Geſtalt und gerade an dieſem Ort keine andere rechtfertigung aufweiſen können, als die Laune ihres Schöpfers, und allenfalls die Allegorie, die Symbolik, den Myſticism und die Anſpielungen auf die laufende Zeit, die er ſo eben im Sinne hatte.
bsb10502094_00606_54	1826	1_2	00606	PHILOSOPHIE	55	https://api.digitale-sammlungen.de/iiif/presentation/v2/bsb10502094/canvas/606/view	Denn wer ſich nur einmal in die Gewalt des Gefühls und der durch das Gefühl erregten Einbildungskraft hingegeben hat, der iſt auch nicht mehr weit von dem blinden Glauben und dem blinden Gehorſam entfernt, den die Hierarchie von ihren Untergebnen fodert“ (S. 85).
gb_GCBRAAAAYAAJ_0293_114	1832	4_5	0293	PHILOSOPHIE	115	https://books.google.de/books?id=GCBRAAAAYAAJ	Sie ist entweder eine reale, welche vereinigt, was sich in der Natur vereinigt findet (so in jedem Erkenntniſsurtheile) , oder eine ideale, aus welcher die Vergleichungen und die Auffassung der Verhältnisse hervorgehn (hiezu gehört auch das generalizzare oder die astrazione intellettuale), oder endlich eine Synthesis der Einbildungskraft.
bsb10502042_00264_35	1806	2	00264	SCHÖNE KÜNSTE	36	https://api.digitale-sammlungen.de/iiif/presentation/v2/bsb10502042/canvas/264/view	Doch wohl nur der erhabenſte Gegenſtand für die Vernunft, nicht zugleich in äſthetiſcher Hinſicht, für Sinn und Einbildungskraft!
bsb10501964_00126_52	1785	3	00126	PHILOSOPHIE	53	https://api.digitale-sammlungen.de/iiif/presentation/v2/bsb10501964/canvas/126/view	Und daher iſt dieſe Syntheſis der Einbildungskraft auch vor aller Erfahrung auf Principien a priori gegründet, und man muſs eine reine transſcendentale Syntheſis derſelben annehmen, die ſelbſt der Möglichkeit aller Erfahrung (als welche die Reproducibilität der Erſcheinungen nothwendig vorausſetzt) zum Grunde liegt.
bsb10502088_00315_34	1823	3_4	00315	PHILOSOPHIE	35	https://api.digitale-sammlungen.de/iiif/presentation/v2/bsb10502088/canvas/315/view	Eher noch möchte der Vorwurf auf die zurückfallen, welche die dichteriſche Einbildungskraft das Geheimniſs enträthſeln laſſen, das der Verſtand nicht zu löſen vermag.
bsb10502093_00028_18	1825	5	00028	GESCHICHTE	19	https://api.digitale-sammlungen.de/iiif/presentation/v2/bsb10502093/canvas/28/view	(Es hätte wohl angeführt werden müſſen, daſs die Franzoſen ſich bereits in dem Reich ihrer Sprache, ihrer Sitten, ihrer Kunſt fühlten, daſs ihre Dichter für dieſes Reich einen Thron ſuchten und in den Romanen von Karl dem Groſsen glänzend errichteten, daſs die franzöſiſche Einbildungskraft mit gewöhnlicher Lebhaftigkeit dieſes Vorbild ergriff, daſs die Dichter-Ideen damals auf das Staatsrecht noch mehr wirkten, als ſpäter die dichteriſchen Staatsſchilderungen von Fenelon, Voltaire und Rouſſeau, daſs König Philipp Auguſt nach der Verwirklichung des Königthums aus jenen geliebten Romanen und Sagen ſtrebte, und daſs nach ſeinem Siege bey Bouvines 1214 über den (Titulär) Kaiſer Otto IIII., in der That aber nur über die Grafen von Flandern und Boulogne, die Dichter ihn als den mächtigſten Siegesfürſten prieſen; das franzöſiſche Volk aber aus ihm ſeinen König machte, deſſen Namen er bisher nur gehabt hatte, ohne ſelbſt unter den franzöſiſchen Landesherren der gröſste zu ſeyn.
bsb10502059_00340_103	1815	2	00340	SCHÖNE KÜNSTE	104	https://api.digitale-sammlungen.de/iiif/presentation/v2/bsb10502059/canvas/340/view	Wenn ſchon in der früheren Form die gelungene Nachbildung des Voſſiſchen Tons bey manchem Eigenthümlichen, das der Vf. in ſich zu erhalten wuſste, wenn beſonderes das ſchöne harmoniſche Versmaaſs, worin er ſeine vor unſre Einbildungskraft vorgeführten Situationen darzuſtellen verſtand, dem Leſer erfreulich ſeyn muſste, ſo zieht jetzt um ſo mehr die durchgängige Ausbeſſerung und ſo manche Veränderung und richtige Zuthat, die wir hier finden an, als ſie, wie von der Aufmerkſamkeit des Vfs. auf ſein Publicum, ſo von ſeiner weiteren Kunſtbeſtrebung und den Fortſchritten in der Kunſt ſelbſt ein rühmliches Zeugniſs ablegt.
bsb10502084_00042_39	1821	5	00042	SCHÖNE KÜNSTE	40	https://api.digitale-sammlungen.de/iiif/presentation/v2/bsb10502084/canvas/42/view	Schon die vom Vf. gewählten Namen, wie Azur, Adeona, Odora u. dergl , deuten auf einen hohen Flug der Phantaſie hin, und man muſs zuletzt einen groſsen Theil dieſer Perſonen für erkünſtelte Geſchöpfe der Einbildungskraft erkennen, die man vergebens ins Leben zu verſetzen ſucht, weil es ihnen an lebendiger Wahrheit fehlt.
bsb10628808_00014_99	1793	3	00014	PHILOSOPHIE	100	https://api.digitale-sammlungen.de/iiif/presentation/v2/bsb10628808/canvas/14/view	[Die beſondere Deduction für das Urtheil über das Erhabene, die eben ſo wenig überflüſſig ſcheint, würde folgendermaſsen ausfallen müſſen: Wenn die Vernunft praktiſch, das heiſst, vermittelſt der die Befriedigungen des Begehrens beſtimmenden Freyheit, folglich unabhängig von der Sinnlichkeit, wirkſam ſeyn ſoll; ſo muſs die an die Sinnlichkeit gebundene Einbildungskraft, durch welche die Vernunft im theoretiſchen Gebrauch nur beſchränkt, (d. i. beym Erkennen nur auf die Sinnenwelt eingeſchränkt) werden kann, im praktiſchen Gebrauch (d.i. bey den Willenshandlungen) den Functionen der Vernunft zur Erweiterung dienen können, und es muſs in ſoferne zwiſchen der Vernunft und der Einbildungskraft eine Zuſammenſtimmung im Gemüthe a priori beſtimmt ſeyn, die darinn beſteht, daſs die Beſchränktheit der Einbildungskraft der praktiſchen Vernunft angemeſſen, oder welches eben ſo viel iſt, daſs das Gebundenſeyn der Einbildungskraft an die Sinnlichkeit für den Vernunftgebrauch beym Wollen zweckmäſsig iſt.
bsb10628810_00129_69	1799	1	00129	ERBAUUNGSSCHRIFTEN	70	https://api.digitale-sammlungen.de/iiif/presentation/v2/bsb10628810/canvas/129/view	Endlich ſucht er die Gründe, warum Kindern beſonders die genannte Pflicht obliege, a) „eine zügelloſe Einbildungskraft bewirkt Zerſtreuung, und hindert die Aufmerkſamkeit, der Unterricht alſo geht nicht von ſtatten, und folglich bleiben Verſtand und Vernunft ungebildet; was aber an Ausbildung der Vernunft hindert, hindert zugleich daran, reines Herzens zu werden, (die Stelle Matth. 5, 8. liegt der Katecheſe zum Grunde), b) in der Jugend iſt die Einbildungskraft am empfänglichſten, und Kinder können durch ſie leicht böſe Menſchen werden.“
bsb10502054_00249_112	1814	1	00249	SCHÖNE KÜNSTE	113	https://api.digitale-sammlungen.de/iiif/presentation/v2/bsb10502054/canvas/249/view	Indem der Vf. dieſer kleinen Schrift von den Leſſingſchen im Laokoon erörterten Sätzen ausgeht, daſs die Zeitfolge das Gebiet des Dichters, der Raum das Gebiet des bildenden Künſtlers ſey, indem er des Vortheils, der daraus für dieſen, des Nachtheils, der für jenen entſpringe, erwähnt (etwas unbeſtimmt und unvollſtändig freylich, da die Grenze des Dichters in der Sphäre der Succeſſion wirklich doch auch manchen reichen Gewinn, den Reiz der Erwartung z. B. durch Aufregung unſrer Einbildungskraft und Empfindung anbietet, der jenem die ſeine verſagt), indem er ſo den Kunſtwerken des Raums den Vortheil anſchaulicher Einheit und den damit verbundenen Vorzug lebhafterer und ſchnellerer Eindrücke Rec. glaubt, durch einen zu geſchwinden Schluſs einräumt, kommt er, ſprungsweiſe beynahe, auf den Mangel der Einheit bey dramatiſchen und epiſchen Dichtungen.
bsb10502001_00288_29	1795	2	00288	PHILOSOPHIE	30	https://api.digitale-sammlungen.de/iiif/presentation/v2/bsb10502001/canvas/288/view	Die reproductive Einbildungskraft wirkt nach den Geſetzen der Ideenaſſociation, die productive nach den Geſetzen der Zweckmäſsigkeit, jene iſt von der Sinnlichkeit abhängig, dieſe ſchafft aus dem, was der Sinnlichkeit dargeboten iſt, Ideale.
bsb10501994_00351_43	1792	4	00351	SCHÖNE KÜNSTE	44	https://api.digitale-sammlungen.de/iiif/presentation/v2/bsb10501994/canvas/351/view	Wenn das Gemüth in einem ſolchen Zuſtande iſt, als wollte man dieſer Freyheit der Einbildungskraft zuvorkommen, ſo werden weder die Bewegungen des Erhabenen noch des Schönen gefühlt.
bsb10502000_00361_63	1795	1	00361	PHILOSOPHIE	64	https://api.digitale-sammlungen.de/iiif/presentation/v2/bsb10502000/canvas/361/view	Denn wäre dieſe veränderlich, ſo daſs ſie ſich auch umkehren lieſse; ſo könnte ihre Syntheſis ſich nicht auf Wahrnehmung gründen, weil es widerſprechend iſt, das Folgende früher als das Vorhergehende wahrzunehmen, mithin wäre ſie nichts weiter, als eine willkührliche ſubjective Syntheſis der Einbildungskraft.
bsb10502008_00253_107	1796	4	00253	PHILOSOPHIE	108	https://api.digitale-sammlungen.de/iiif/presentation/v2/bsb10502008/canvas/253/view	Eine Unterſcheidung, die man in der neuen Theorie der Einbildungskraft (der erſten Abh. in Schmid's pſychologiſchem Magazin. Band. I.) weiter auseinander geſetzt findet.
bsb10541100_00353_65	1794	4	00353	PHILOSOPHIE	66	https://api.digitale-sammlungen.de/iiif/presentation/v2/bsb10541100/canvas/353/view	Denn wäre diefe veränderlich, ſo daſs ſie ſich auch umkehren lieſse; ſo könnte ihre Syntheſis ſich nicht auf Wahrnehmung gründen, weil es widerfprechend iſt, das Folgende früher als das Vorhergehende wahrzunehmen, mithin wäre ſie nichts weiter, als eine willkührliche ſubjective Syntheſis der Einbildungskraft.
bsb10628812_00073_5	1799	3	00073	PHILOSOPHIE	6	https://api.digitale-sammlungen.de/iiif/presentation/v2/bsb10628812/canvas/73/view	Keine Erſcheinung darf abſolute Verehrung von uns fodern, auch nicht das von unſerer Einbildungskraft aufgeſtellte Bild von Gott.
bsb10628808_00013_64	1793	3	00013	PHILOSOPHIE	65	https://api.digitale-sammlungen.de/iiif/presentation/v2/bsb10628808/canvas/13/view	Die gegebene Gröſse eines anſchaulichen Gegenſtandes, die wirklich über jenes Maximum hinausgehet, und folglich durch die darſtellende Einbildungskraft nicht erreicht werden kann, iſt äſthetiſch-unermeſslich, und die Wahrnehmung derſelben iſt durch das ſie begleitende Gefühl der Unangemeſſenheit unſerer Einbildungskraft zur Gröſse des Objectes, und folglich unſeres beſchränkten Vermögens mit Unluſt verbunden.
bsb10502002_00042_60	1795	3	00042	SCHÖNE KÜNSTE	61	https://api.digitale-sammlungen.de/iiif/presentation/v2/bsb10502002/canvas/42/view	Abentheuerliche Scenen, welche der Einbildungskraft nicht viel ſchöne Bilder geben; geſuchte Redensarten und übertriebene Kraftwörter, welche den alten Rittergeiſt ausdrücken ſollen, und nicht ſelten dem Ganzen einen Anſtrich von Unſittlichkeit geben, ſind in dem Buche nicht geſpart.
bsb10501964_00126_13	1785	3	00126	PHILOSOPHIE	14	https://api.digitale-sammlungen.de/iiif/presentation/v2/bsb10501964/canvas/126/view	Nun ſind drey urſprüngliche Quellen, Fähigkeiten oder Vermögen der Seele, Sinn, Einbildungskraft und Apperception.
bsb10502089_00578_87	1823	5	00578	ERBAUUNGSSCHRIFTEN	88	https://api.digitale-sammlungen.de/iiif/presentation/v2/bsb10502089/canvas/578/view	Uebrigens iſt er fern von allem, was Schwärmerey begünſtigen könnte, durch den Verſtand wollte er, nach ſeiner eigenen Ausſage in der Abſchiedspredigt, bey allen ſeinen Vorträgen den Weg zum Herzen ſuchen, und nicht durch falſchen Schmuck und Schimmer, wollte nicht durch den Tand frömmelnder Worte das Gefühl überreizen oder mit dem Spiele eines eiteln Witzes die Einbildungskraft unterhalten u. ſ. w.
bsb10501988_00393_110	1791	2	00393	GOTTESGELAHRTHEIT	111	https://api.digitale-sammlungen.de/iiif/presentation/v2/bsb10501988/canvas/393/view	Der erſten Menſchen Ungehorſam beym erſten Reiz der Sinnlichkeit und Einbildungskräfte beweiſet das Gegentheil, und daſs ſie ſich einander als tugendhafte Ehegatten liebten S. 12.
bsb10501964_00126_44	1785	3	00126	PHILOSOPHIE	45	https://api.digitale-sammlungen.de/iiif/presentation/v2/bsb10501964/canvas/126/view	Würde der Zinnober bald roth, bald ſchwarz, bald leicht, bald ſchwer ſeyn, ein Menſch bald in dieſe, bald in jene thieriſche Geſtalt verändert werden, am längſten Tage bald das Land mit Früchten, bald mit Eis und Schnee bedeckt ſeyn, ſo könnte die empiriſche Einbildungskraft nicht einmal Gelegenheit bekommen bey der Vorſtellung der rothen Farbe an den ſchweren Zinnober u. ſ. w. zu denken.
bsb10502006_00098_61	1796	2	00098	PHILOSOPHIE	62	https://api.digitale-sammlungen.de/iiif/presentation/v2/bsb10502006/canvas/98/view	Verſtand und Vernunft geben der Urtheilskraft Stoff zu Urtheilen und Schlüſſen, ſie bringen aber dieſe nicht ſelbſt hervor.
bsb10501992_00183_73	1792	2	00183	PHILOSOPHIE	74	https://api.digitale-sammlungen.de/iiif/presentation/v2/bsb10501992/canvas/183/view	Uebrigens iſt es ſehr wahrſcheinlich, daſs ſich Sokrates, ein Mann von feuriger Einbildungskraft, der in der Einſamkeit, ganz in ſich verſenkt, ſo anhaltend nachdachte, der zufolge ſeines ungetheilten Intereſſe für die Sittenlehre, ſie in allen ihren nahen und entfernten Beziehungen durchdenken muſste, in deſſen reiner und edler Seele das moraliſche Bedürfniſs der Unſterblichkeit ſehr dringend ſeyn muſste, oft und gern mit dieſer Unterfuchung werde abgegeben haben, daſs folglich alles ſubjectiviſche in den platoniſchen Beweiſen für ächt ſokratiſch anzuſehen iſt.
bsb10502092_00624_102	1825	3_4	00624	SCHÖNE KÜNSTE	103	https://api.digitale-sammlungen.de/iiif/presentation/v2/bsb10502092/canvas/624/view	Hier muſs er nothwendig die Einbildungskraft ein wenig zur Aſtronomin machen, ſey es zur Tychonianerin oder zur Copernicanerin, wenn er überhaupt eine Anſchauung von dieſem WeltkörperUmlaufe geben will.
bsb10502011_00084_15	1797	3	00084	ARZNEYGELAHRTHEIT	16	https://api.digitale-sammlungen.de/iiif/presentation/v2/bsb10502011/canvas/84/view	Die Einbildungskraft, oder die Fähigkeit des Seelenorgans bloſs durch innere Reize Vorſtellungen zu erregen, die ehedem durch die Sinne und durch das Gemeingefühl percipirt worden waren, wird durch die innere Thätigkeit des Gehirns und durch die nämlichen Faſern deſſelben bewirkt, wie die vorhergegangenen Senſationen: denn die Seelenkraft iſt auf die Fähigkeit eingeſchränkt, Senſationen und Einbildungen, nothwendige und eigenmächtige Vorſtellungen zu beſitzen.
bsb10502036_00433_9	1804	4	00433	SCHÖNE KÜNSTE	10	https://api.digitale-sammlungen.de/iiif/presentation/v2/bsb10502036/canvas/433/view	Berlin, in d. Mylius'ſchen Buchh.: Markus Akinſide's Vergnügungen der Einbildungskraft.
bsb10502009_00174_42	1797	1	00174	SCHÖNE KÜNSTE	43	https://api.digitale-sammlungen.de/iiif/presentation/v2/bsb10502009/canvas/174/view	Sein aufrichtiges Herz war viel1eicht die Quelle der Meynung, die er hier vorausſchickt, und in ſofern gehört ſie mit zu ſeinen Bekenntniſſen, die zu ſchreiben er bey derſelben unſtreitig geſchickter war, als irgend ein Kunſtwerk der dichtenden Einbildungskraft in dieſem Fache hervor zu bringen.
bsb10628808_00018_34	1793	3	00018	PHILOSOPHIE	35	https://api.digitale-sammlungen.de/iiif/presentation/v2/bsb10628808/canvas/18/view	In der Antitheſis ſollte es heiſsen: „jenes Urtheil gründet ſich aber gleichwohl auch auf einen, aber nicht in der Anſchauung beſtimmten, Begriff von dem Objecte,“ – dem das Prädicat ſchön nur in ſofern beygelegt werden kann, als daſſelbe, unabhängig von der Anſchauung und folglich nicht durch Verſtand, ſondern durch Vernunft, als ein Ding gedacht wird, welches die Einbildungskraft bey der Äuffaſſung ſeiner Geſtalt in der Anſchauung au eine durch ſich ſelbſt mit dem Verſtande harmoniſche Weiſe beſchäftigt.
bsb10502017_00068_104	1800	1	00068	SCHÖNE KÜNSTE	105	https://api.digitale-sammlungen.de/iiif/presentation/v2/bsb10502017/canvas/68/view	Die Kupferſtiche ſelbſt find zwar in Abſicht der Arbeit nur von mittelmäſsiger Güte, aber doch ſo beſchaffen, daſs die Einbildungskraft deutliche und beſtimmte Bilder dadurch empfängt.
bsb10501990_00450_65	1791	4	00450	PHILOSOPHIE	66	https://api.digitale-sammlungen.de/iiif/presentation/v2/bsb10501990/canvas/450/view	Die Einbildungskraft ſoll (§. 244.) Empfindungen, der Verſtand ſoll Begriffe aufſuchen und durch eigne Fähigkeit ergreifen; oben (§ 241.) ſollten die Empfindungen durch Einbildungskraft bewirkt und durch Verſtand zu Begriffen erhöht werden.
bsb10502000_00261_116	1795	1	00261	PHILOSOPHIE	117	https://api.digitale-sammlungen.de/iiif/presentation/v2/bsb10502000/canvas/261/view	In wie ferne nun Hr. P. ſeinen in jeder Rückſicht unrichtigen Begriff von der Logik, dem Begriſſe, den die Freunde der kritiſchen Philoſophie mit dieſem Worte verbinden, unterſchiebt; in ſoferne, aber auch nur in ſo ſorn iſt er berechtigt, nicht nur die Lehre von der Sinnlichkeit, Einbildungskraft, Phantaſie, Sprache u. ſ. w. in der Logik als Beſtandtheile derſelben abzuhandeln, ſondern auch zu behaupten: „das ganze Uebel, worüber man ſo viele Klagen führe, beſtehe darin, daſs er die Lehre von den Begriffen, Urtheilen und Schlieſsen nicht die reine Logik genannt habe“ — „und Kant wolle nichts weiter als „daſs die Pſychologie von einem Theile der Logik, nemlich der Reinen, getrennt werde, mit welchem ſie doch ſeines Wiſſens kein Schriftſteller ſonderlich verbunden habe.“
bsb10502033_00464_37	1804	1	00464	PHILOSOPHIE	38	https://api.digitale-sammlungen.de/iiif/presentation/v2/bsb10502033/canvas/464/view	Nur hätte Rec. nach der Auflöſung der Einbildungskraft in mehrere einzelne Vermögen auch ihre Wiedervereinigung in ihrer thätigen Wechſelwirkung bemerkbarer gemacht zu ſehen gewünſcht (nach der Analyſe folge immer die Syntheſis!), nicht minder den Einfluſs höherer Vermögen auf die Einbildungskraft; wie ſchon der gegenſeitige Abbruch, den das Aſſociationsvermögen und die Phantaſie ſich thun, hier berührt wurde.
bsb10541099_00338_86	1794	3	00338	SCHÖNE KÜNSTE	87	https://api.digitale-sammlungen.de/iiif/presentation/v2/bsb10541099/canvas/338/view	In einem Gedicht muſs alles wahre Natur ſeyn, denn die Einbildungskraft gehorcht keinem andern Geſetze, und erträgt keinen andern Zwang, als den die Natur der Dinge ihr vorſchreibt; in einem Gedicht darf aber nichts wirkliche (hiſtoriſche) Natur ſeyn, denn alle Wirklichkeit iſt mehr oder weniger Beſchränkung jener allgemeinen Naturwahrheit.
bsb10502013_00085_41	1798	1	00085	GESCHICHTE	42	https://api.digitale-sammlungen.de/iiif/presentation/v2/bsb10502013/canvas/85/view	Er bemerkt, daſs Z. wirklich ein Genie geweſen ſey; viel Witz, ein ungewöhnlich ſtarkes Gedächtniſs, und eine feurige Einbildungskraft beſeſſen habe; welche letzte daher oft die kaltblütige Ueberlegung verdrängt, und Uebereilungen erzeugt habe; ſeine Beurtheilungskraft ſey, nach Lynars Anmerkung, nicht ſo ſchlecht geweſen, als man insgemein glaube; der gröſste Mann könne ſich in ſeinen Urtheilen trügen; aber man werde doch finden, daſs er mehrentheils richtig geurtheilt habe, welches auch ſein guter Verſtand, ſeine vielen Sach- und Menſchenkenntniſſe, ingleichen ſeine mancherley Erfahrungen, erwarten lieſsen; den Ehrgeiz zur Triebfeder ſeiner Handlungen zu machen, das könnten nur ſeine unbeſonnenſten Feinde thun, dagegen ſey Liebe zur Religion, und beſonders eine zärtliche Zuneigung zu Chriſto, Hauptzug in ſeinem Charakter, und die eigentliche Triebfeder aller ſeiner Reden und Handlungen geweſen u.ſ.w.
bsb10502068_00279_21	1817	3	00279	SCHÖNE KÜNSTE	22	https://api.digitale-sammlungen.de/iiif/presentation/v2/bsb10502068/canvas/279/view	In der Vorrede werden zuvörderſt ſehr bündig alle Schwierigkeiten dieſer Art der Dichtkunſt gezeigt; der Vf. ſagt, er habe ſich an die Geſchichte gehalten, und nur dann und wann ſeinen Gegenſtand zu verſchönern geſucht, aber einige romantiſche Fälle ausgenommen, ſelbſt ſeine Einbildungskraft gefeſſelt, um nicht Umſtände oder Thatſachen zu erdichten.
