bsb10502041_00109_51	1806	1	00109	GESCHICHTE	52	https://api.digitale-sammlungen.de/iiif/presentation/v2/bsb10502041/canvas/109/view	Die Richtung der Einbildungskraft auf einen einzelnen Gegenſtand, bis wir einen vollſtändigen Begriff von ihm haben, iſt die erſte Operation des Verſtandes, die ihm ſelbſt die natürliche Logik vorſchreibt, wenn er einen leichten und ſichern Weg zur Erkenntniſs gehn will.
bsb10501990_00224_19	1791	4	00224	SCHÖNE KÜNSTE	20	https://api.digitale-sammlungen.de/iiif/presentation/v2/bsb10501990/canvas/224/view	Bey dem geringen Zuſammenhang den dieſes Feenmährchen von jeher hatte, und nach ſeiner Abſicht (da der Vf. minder durch gut verbundne Begebenheiten, als durch Gemälde und Satire unterhalten wollte) bey den vielen Auswüchſen einer luxurirenden Einbildungskraft, die es enthielt, hatte es der Vf. ganz in ſeiner Gewalt, es ſo viel zu verkürzen, als ihm beliebte.
bsb10501971_00063_62	1787	1	00063	PHILOSOPHIE	63	https://api.digitale-sammlungen.de/iiif/presentation/v2/bsb10501971/canvas/63/view	Rec. muſs wenigſtens bekennen, daſs die Einbildungskraft, dieſes einem ſchöpferiſchen ſo analogiſche Vermögen, ihm etwas zu erhabenes iſt, als daſs er es zu einem bloſſen Eindrucke des Gehirnbreys herabwürdigen könnte, und daſs die Erdichtung der Gehirneindrücke ihm die ganze Lehre von der Einbildungskraft nicht im mindeſten aufklärt, dagegen ihn in ein Labyrinth von Schwierigkeiten führt, aus welchem er vergeblich einen Ausgang ſucht.
bsb10541099_00353_108	1794	3	00353	SCHÖNE KÜNSTE	109	https://api.digitale-sammlungen.de/iiif/presentation/v2/bsb10541099/canvas/353/view	Hier wird dann auf Einbildungskraft und Empfindung vorzüglich gewirkt; und dieſe Eigenſchaft gehört eigentlich zum Schmuck der Rede.
bsb10501971_00389_44	1787	1	00389	PHILOSOPHIE	45	https://api.digitale-sammlungen.de/iiif/presentation/v2/bsb10501971/canvas/389/view	Gleichwie die Trunkenheit die Nerven angreift, ſo greift ſie auch die romantiſche Einbildungskraft an.
bsb10541097_00422_125	1794	1	00422	LITERARGESCHICHTE	126	https://api.digitale-sammlungen.de/iiif/presentation/v2/bsb10541097/canvas/422/view	Man bemerkte an Howard eine auſserordentliche Lebhaftigkeit und Feuer in allen ſeinen Bewegungen und Aeuſſerungen, vorzüglich in Ausführung ſeiner Plane, wo ihn der regſte Eifer, ſo viel als möglich Gutes zu wirken, beſeelte, keinesweges aber die Hitze einer entflammten Einbildungskraft, welche Enthuſiasmus hervorbringt, zu den er wegen ſeines kalten und gleichgültigen Temperaments völlig unfähig war.
bsb10502061_00529_95	1815	4	00529	SCHÖNE KÜNSTE	96	https://api.digitale-sammlungen.de/iiif/presentation/v2/bsb10502061/canvas/529/view	Die Vfn. hat auf eine ſehr ergreifende Weiſe alle Hebel in Bewegung geſetzt, welche auf die Einbildungskraft einwirken können und es iſt ihr fehr gelungen eine ſchauerliche und doch lieblich und freundlich endende Geſchichte zu dichten.
bsb10502018_00246_59	1800	2	00246	PHILOSOPHIE	60	https://api.digitale-sammlungen.de/iiif/presentation/v2/bsb10502018/canvas/246/view	Dieſemnach follte, nach einer vorläufigen Betrachtung (I.) über Sinnlichkeit und Einbildungskraft, als Mittel, Vernunft und Willen zur Annahme und Befolgung der Religionsvorſchriften empfänglich zu machen, von der Verſchiedenheit des Religionsbedürfniſſes (II.) und der Relionsfähigkeiten des Menſchen, (III.) um danach die dieſen Bedürfniſſen und Fähigkeiten angemeſſenen Mittel, die Menſchen durch Religion zur Sittlichkeit zu leiten, beſtimmen zu können, gehandelt werden.
bsb10502087_00364_19	1823	1_2	00364	PHILOSOPHIE	20	https://api.digitale-sammlungen.de/iiif/presentation/v2/bsb10502087/canvas/364/view	Iſt denn aber der Pſycholog, welcher die menſchliche Seele gründlicher kennen zu lernen gedenkt, wenn er die Vermögen im Einzelnen betrachtet, durchaus genöthigt, immer nur bey einem derſelben ſtehen zu bleiben, und kann er nicht auch, wenn er von der Einbildungskraft handelt, bemerken, daſs zur dichtenden Einbildungskraft auch eine Erſchütterung des Gefühls gehöre, oder iſt er des– halb etwa nicht berechtigt, die Einbildungskraft vorzugsweiſe das Dichtungsvermögen zu nennen, weil das Geſchäft der productiven Darſtellung doch nim– mer dem Gefühle anheimfallen kann, mithin ein Theil des Vorſtellungsvermögens, nämlich die Einbildungskraft, beym Dichter das eigentlich thätige nn das Gefühl nur der Grund jener Thätigkeit iſt.
bsb10501991_00035_48	1792	1	00035	PHILOSOPHIE	49	https://api.digitale-sammlungen.de/iiif/presentation/v2/bsb10501991/canvas/35/view	Eines andern kann er wohl ſchwerlich durch ein Raiſonnement belehrt werden, in welchem, man weiſs nicht wie, Raum und Zeit als die Formen der Einbildungskraft und die Kategorien als tranſcendentale Erdichtungen der Einbildungskraft auftreten.
bsb10502060_00248_58	1815	3	00248	SCHÖNE KÜNSTE	59	https://api.digitale-sammlungen.de/iiif/presentation/v2/bsb10502060/canvas/248/view	Dieſe Auswüchſe des Wunderbaren ſcheinen ſelbſt über die Grenzen eines möglichen Volksaberglaubens hinaus zu reichen, und Rec. iſt geneigt, ſie für Verirrungen der Einbildungskraft in dem Gebiete des Myſticismus zu halten, wovon in den unvergänglichen Muſtern der Alten keine Spur ſich findet, und welche eine eigentliche tragiſche Wirkung eben ſo wenig hervorbringen können, als z. B. die Hexenküche im Macbeth, und der Drudenfuſs im Fauſt, deſſen winzig kleines Häkchen dem Teufel den Ausgang aus Fauſts Stube wehrt, darauf berechnet ſeyn möchten.
bsb10502042_00107_23	1806	2	00107	SCHÖNE KÜNSTE	24	https://api.digitale-sammlungen.de/iiif/presentation/v2/bsb10502042/canvas/107/view	Man kann aber gewiſs nicht mehr zum Lobe ſagen, als: alle Veränderungen ſeyen von der Art, daſs der miſsliche Punkt, die Reflexion des Zuſchauers auf Koſten der Einbildungskraft zu beſchäftigen, gehoben iſt.
bsb10502033_00463_92	1804	1	00463	PHILOSOPHIE	93	https://api.digitale-sammlungen.de/iiif/presentation/v2/bsb10502033/canvas/463/view	Warum nicht die letzte wiederholende Einbildungskraft, deren Reproduciren ein ſchon vorhergegangenes Produciren vorausſetzt, – für das Nachbildungsvermögen der urſprünglichen Bilder?
bsb10502031_00030_44	1803	3	00030	PHILOSOPHIE	45	https://api.digitale-sammlungen.de/iiif/presentation/v2/bsb10502031/canvas/30/view	Sind denn Ideen der Einbildungskraft, äſthetiſche Ideen, Vernunftideen und nothwendige, unbedingte Regeln der Vernunft ?
bsb10502015_00029_55	1798	3	00029	SCHÖNE KÜNSTE	56	https://api.digitale-sammlungen.de/iiif/presentation/v2/bsb10502015/canvas/29/view	Leider aber wird auch durch den allzu häufigen Gebrauch dieſes Mittels und Zwecks die productive Einbildungskraft der Romanenſchreiber, indern ſie ſich immer in demſelben Ideenkreiſe herumtreibt, einſeitig; in der Bearbeitung des Stoffs halten das Wunderbare und Wahrſcheinliche nicht gleichen Schritt, ſondern erſtes iſt gewöhnlich auf Unkoſten des letzten ſo hoch getrieben, daſs der Gedanke an die Möglichkeit einer Begebenheit, als Wirkung nach Naturgeſetzen, völlig vernichtet wird, und die Einbildungskraft der Leſer alten feſten Grund unter ſich verliert; endlich wird auch bey der Begierde, dem Eindruck des Wunderbaren in den Gemüthern der Leſer die höchſte Energie zu geben, die Schilderung der Charaktere der handelnden Perſonen vernachläſsigt, und der Gang der Begebenheiten und die Situationen erſcheinen mehr als wunderbare durch blinden Zufall bewirkte Ereigniſſe, denn als natürlich eingeleitete und herbeygeführte Erfolge vorhergegangener Natururſachen.
bsb10628812_00072_122	1799	3	00072	PHILOSOPHIE	123	https://api.digitale-sammlungen.de/iiif/presentation/v2/bsb10628812/canvas/72/view	Der Anthropomorphismus iſt für den wirklichen Menſchen unvermeidlich, der bey dem Gebrauche deſſelben es nie vergeſſen ſoll, daſs er die in ſeiner Einbildungskraft aufgeſtellte Abbildung von der Gottheit nur zu ſeinem Bedürfiſſe gemacht hat; hält er das Bild von der Gottheit für gegeben, ſo wird er ein Abgötter.
bsb10541099_00344_78	1794	3	00344	SCHÖNE KÜNSTE	79	https://api.digitale-sammlungen.de/iiif/presentation/v2/bsb10541099/canvas/344/view	Nur von ihm wird es abhängen, jetzt endlich, nachdem er in beſcheideneren Kreiſen ſeine Schwingen verſucht hat, einen höheren Flug zu nehmen, in die anmuthigen Formen ſeiner Einbildungskraft und in die Muſik ſeiner Sprache einen tiefen Sinn einzukleiden, zu ſeinen Landſchaften nun auch Figuren zu erfinden, und auf dieſen reizenden Grund handelnde Menſchheit aufzutragen.
bsb10628808_00012_70	1793	3	00012	PHILOSOPHIE	71	https://api.digitale-sammlungen.de/iiif/presentation/v2/bsb10628808/canvas/12/view	Sie beſteht nemlich in derjenigen Zweckmäſsigkeit der Geſtalt, die ſich dem Gemüthe durch die bloſse Anſchauung, und folglich ganz unabhängig von dem Begriffe eines objectiven Zweckes ankündiget, und die in der bloſsen Angemeſſenheit derſelben durch die bey der Anſchauung vorkommende Beſchäftigung der Einbildungskraft zum Verſtande beſteht.
bsb10502081_00238_67	1820	4	00238	GESCHICHTE	68	https://api.digitale-sammlungen.de/iiif/presentation/v2/bsb10502081/canvas/238/view	Er nennt ſie die genialſte Frau von Frankreich, und wer wird dieſs leugnen? aber ihr Geiſt war nicht bloſs franzöſiſchen Urſprungs, und nicht Eine, ſondern die ganze eigenthümliche Strebung deſſelben ſcheint ſich aus folgenden ſcharfſinnigen Bemerkungen zu erklären: „Geſtellt durch ihre Geburt und ſpäterhin durch ihre perſönlichen Verhältniſſe auf einen Punct zwiſchen Frankreich, Deutſchland und Italien; alle dieſe drey Länder durch ihre vieljährigen Reiſen aus eigner Anſchauung kennen lernend, und begabt mit einer eben ſo ungemein beweglichen Einbildungskraft als tiefer Empfänglichkeit für alles ihr ſich darſtellende Groſse, Schöne und Gute, war es unmöglich, daſs ſie dem Einfluſs entging, den die Reihe von Eindrücken dreyer in ihrer Sprache, ihren Sitten, und ihrer Literatur ſo höchſt verſchiedenen Länder, nach einander auf eine ſo wiſsbegierige und reizbare Seele nothwendig hervorbringen muſste.
bsb10502065_00418_97	1816	4	00418	SCHÖNE KÜNSTE	98	https://api.digitale-sammlungen.de/iiif/presentation/v2/bsb10502065/canvas/418/view	Nach ihm gehört zur Empfindung des Schönen: Bewuſstſeyn, Erinnerungskraft (nur leiſe wirkſam), Verſtand (als Erkenntniſsvermögen der Einheit in der Mannichfaltigkeit, die aber nicht immer äſthetiſch iſt), vorzüglich Einbildungskraft, die er lieber in äſthetiſcher Hinſicht Phantaſie nennen wolle, (eine Benennung, die uns die der Willkür unterworfene Einbildungskraft nicht von der unwillkürlichen Thätigkeit denſelben ſo ſcharf zu unterſcheiden ſcheint, als die Benennung: Imagination).
bsb10502033_00492_103	1804	1	00492	GESCHICHTE	104	https://api.digitale-sammlungen.de/iiif/presentation/v2/bsb10502033/canvas/492/view	Er war dabey weder in einen Traum der Einbildungskraft verliebt, noch für irgend eine ſtrenge Sittenvorſchrift heftig eingenommen; ſondern eine willkührliche Satzung des Arianiſmus, die hiſtoriſche Meinung, daſs dieſelbe der älteſte Chriſtenglaube geweſen ſey, und das günſtige Vorurtheil für ein abgeſchmacktes Buch, die apoſtoliſchen Conſtitutionen, hatten ſich ſeines Verſtandes bemächtigt, und hieraus entſtanden ſeine weitern Verirrungen, ſein unüberwindlicher Meinungseifer, ſeine apokalyptiſchen Phantaſieen.
bsb10502027_00569_85	1802	3	00569	SCHÖNE KÜNSTE	86	https://api.digitale-sammlungen.de/iiif/presentation/v2/bsb10502027/canvas/569/view	Der Zweck des anonymen Vfs. war: „einen Fauſt mit philoſophiſcher Wahrſcheinlichkeit für die Bühne zu bearbeiten, inſofern das eine Factum der Verbindung mit der Geiſterwelt als wahr angenommen wird, jede Scene pſychologiſch richtig darzuſtellen, und ihn durch alle Auftritte, die bey einer ſo merkwürdigen Begebenheit vorfallen müſſen, ſo durchzuführen, daſs er nicht allein vor dem Richterſtuhle der Einbildungskraft, ſondern auch des Verſtandes beſtehen könne.“
bsb10502088_00449_31	1823	3_4	00449	ARZNEYGELAHRTHEIT	32	https://api.digitale-sammlungen.de/iiif/presentation/v2/bsb10502088/canvas/449/view	Von dem Einfluſs der Luftelectricität, des Lichts, und des Manetismus auf die Blutbewegung, der ſich ſogar auf die Einbildungskraft, Empfindungsvermögen u. ſ. w. erſtrecken ſoll, werden intereſſante Beobachtungen beygebracht.
bsb10628808_00013_26	1793	3	00013	PHILOSOPHIE	27	https://api.digitale-sammlungen.de/iiif/presentation/v2/bsb10628808/canvas/13/view	Das Object des Einen iſt eine Geſtalt, die in der Auffaſſung der Einbildungskraft, und durch dieſe dem Verſtande angemeſſen iſt; das Object des Andern iſt eine Gröſse, welche die Schranken der Einbildungskraft in der Zuſammenfaſſung zu einem anſchaulichen Ganzen überſchreitet, und folglich der Einbildungskraft unangemeſſen, aber eben dadurch, wie der Folge gezeigt wird, der Vernunft angemeſſen iſt.
bsb10502023_00069_49	1801	3	00069	GESCHICHTE	50	https://api.digitale-sammlungen.de/iiif/presentation/v2/bsb10502023/canvas/69/view	Der Stoff hat wenig Anziehendes für die Einbildungskraft; die Begebenheiten ſind nicht einfluſsreich genug; obgleich das Spiel der Leidenſchaften in ihnen nicht unthätig war.
bsb10502089_00108_104	1823	5	00108	ARZNEYGELAHRTHEIT	105	https://api.digitale-sammlungen.de/iiif/presentation/v2/bsb10502089/canvas/108/view	Der Vf. theilt aus ältern Beobachtern eine groſse Anzahl von Beobachtungen mit, in denen dieſe ſymptomatiſche Hydrophobie entſtand 1) nach Schrecken, 2) Aerger, 3) Schaam, 4) Zorn, 5) zu lebhafte Einbildungskraft, 6) Inſolation, 7) Kopfwunden, 8) Epilepſie, 9) kaltes Getränke, 10) als Symptom bösartiger, ſelbſt epidemiſcher Fieber und mehrerer anderer Krankheiten.
bsb10502005_00480_84	1796	1	00480	PHILOSOPHIE	85	https://api.digitale-sammlungen.de/iiif/presentation/v2/bsb10502005/canvas/480/view	Das wichtige Werk über die Einbildungskraft von Maaſs ſcheint der Vf. nicht benutzt zu haben, ſonſt würde er S. 149 nicht die Kraft der Trägheit und die Kraft der Bewegung, welche die Seele mit dem Körper gemein haben ſoll, als das Princip betrachtet haben, unter welchem die einzelnen Geſetze der Ideenverbindung ſtünden.
bsb10541099_00340_40	1794	3	00340	SCHÖNE KÜNSTE	41	https://api.digitale-sammlungen.de/iiif/presentation/v2/bsb10541099/canvas/340/view	Der Tonſetzer und der Landſchaftmaler bewirken dieſes bloſs durch die Form ihrer Darſtellung, und ſtimmen bloſs das Gemüth zu einer gewiſſen Empfindungsart und zur Aufnahme gewiſſer Ideen; aber einen Inhalt dazu zu finden, überlaſſen ſie der Einbildungskraft des Zuhörers und Betrachters.
bsb10541082_00108_62	1790	2	00108	ARZNEYGELAHRTHEIT	63	https://api.digitale-sammlungen.de/iiif/presentation/v2/bsb10541082/canvas/108/view	Man leſe und beherzige alſo vorzüglich, was der Vf. von den Kennzeichen der Schwangerſchaft, dem Unterſchied der wahren und falſchen, von der Einrichtung der Diät, von den Wirkungen der verſchiedenen Arten von Bewegung, von der Wichtigkeit der Reinlichkeit und einer ſchicklichen Kleidung, vom Gebrauch und Miſsbrauch des Aderlaſſens und andrer Arzneymittel, von der monatlichen Reinigung während der Schwangerſchaft, von den Einfluſſe der Leidenſchaften, Einbildungskraft und ehelichen Liebe auf dieſen Zuſtand, und endlich vom Verhalten bey unzeitigen, frühen und natürlichen Geburten ſagt; – alles Dinge, worüber noch häufige und ſchädliche Vorurtheile herrſchen, zu deren Berichtigung man jeder Neuvermählten, die den Werth ihrer Beſtimmung fühlt, dieſen Rathgeber ſicher empfehlen kann.
bsb10502070_00039_94	1818	1	00039	PHILOSOPHIE	95	https://api.digitale-sammlungen.de/iiif/presentation/v2/bsb10502070/canvas/39/view	Sehr ſinnreich aber iſt die beygegebene Theorie der Einbildungskraft.
bsb10501979_00284_100	1789	1	00284	GESCHICHTE	101	https://api.digitale-sammlungen.de/iiif/presentation/v2/bsb10501979/canvas/284/view	Eben ſo frey bemerken wir, daſs in manchen Betrachtungen dieſer Art, z. B. S. 92. u. a. beynahe eine Abſtraction der Einbildungskraft, und eine halb metaphyſiſche Sprache herrſcht, die doch wohl kaum der rechte Ausdruck hiſtoriſcher Betrachtungen iſt.
bsb10502070_00217_25	1818	1	00217	SCHÖNE KÜNSTE	26	https://api.digitale-sammlungen.de/iiif/presentation/v2/bsb10502070/canvas/217/view	Ein Werk, das bey manchen Spuren jugendlicher Unreife eine Fülle von Einbildungskraft, kräftige Darſtellung und tiefen Blick in die Natur und das Herz verräth.
bsb10501965_00250_72	1785	4	00250	PHILOSOPHIE	73	https://api.digitale-sammlungen.de/iiif/presentation/v2/bsb10501965/canvas/250/view	Was der Herausgeber hier vom Gedächtniſs ſagt, das paſst völlig auf die Einbildungskraft, wenn ſie nach Ideenaſſociationen wirkt; und was er zuletzt von der Einbildungskraft ſagt, rührt von dem Erdichtungsvermögen her.
bsb10502018_00108_119	1800	2	00108	SCHÖNE KÜNSTE	120	https://api.digitale-sammlungen.de/iiif/presentation/v2/bsb10502018/canvas/108/view	ſo müſſen wir dem Vf. rathen, ſeinen Trieb zu ſchreiben entweder ganz zu unterdrücken, oder, wenn er das nicht vermöchte, bey einem Gegenſtande zu befriedigen, der weder Einbildungskraft noch Geſchmack erfodert.
bsb10502011_00200_112	1797	3	00200	SCHÖNE KÜNSTE	113	https://api.digitale-sammlungen.de/iiif/presentation/v2/bsb10502011/canvas/200/view	So wenig man mit der Kunſtlehre bis jetzt noch ins Klare gekommen iſt, ſo iſt es doch ausgemacht, daſs, wie ſchöne Kunſtwerke nur aus dem innigſten Bunde der Vernunft mit der Einbildungskraft hervorgehen, ſie auch das Höchfte, was im Menſchen iſt, in Anſpruch nehmen, und daſs der Gipfel der Bildung nur durch die, alle Kräfte harmoniſch vereinigenden, Zauber der Kunſt erreicht wird.
bsb10502012_00074_8	1797	4	00074	SCHÖNE KÜNSTE	9	https://api.digitale-sammlungen.de/iiif/presentation/v2/bsb10502012/canvas/74/view	No. 2. Wer einmal durch Rittergeſchichten ſchon verdorben iſt, der kann in Stunden der Muſse, wo er ſeiner Einbildungskraft ein leichtes Spiel gönnen will, in der gegenwärtigen Schrift eine angenehme Unterhaltung ſinden, die nur zu oft durch die übertriebene Sucht nach Allegorien und Gleichniſſen geſtört wird.
bsb10502047_00036_38	1811	3	00036	PHILOSOPHIE	39	https://api.digitale-sammlungen.de/iiif/presentation/v2/bsb10502047/canvas/36/view	Richtigkeit ſchreibt der Vf. der Einbildungskraft zu, „wenn ſie mit Geſchmack das wahre, der Sache angemeſſene Bild wählt, nicht ins Weite und Grenzenloſe herumſchweift, oder ein bloſses Spiel ohne Zweck und Ordnung treibt:“ es leuchtet aber ein, daſs er hier Richtigkeit und Regelmäſsigkeit verwechſelt, oder vermengt.
bsb10502073_00069_35	1818	4	00069	PHILOSOPHIE	36	https://api.digitale-sammlungen.de/iiif/presentation/v2/bsb10502073/canvas/69/view	Der Vf. folgt hier der Anſicht Reils, ſetzt in das Cerebralſyſtem die geiſtige Seele, die ſinnliche und fühlende in das Ganglienſyſtem, mit welchem faſt alle Erſcheinungen des Erinnerungsvermögens und der reproducirenden Einbildungskraft im Zuſammenhange ftehn, und wodurch alles Periodiſche, alle Zeiteintheilung ins thieriſche Leben kommen ſoll.
bsb10502045_00321_67	1811	1	00321	PHILOSOPHIE	68	https://api.digitale-sammlungen.de/iiif/presentation/v2/bsb10502045/canvas/321/view	Der Vf. ſcheint zu einſeitig das Weſen der Schönheit in die Form zu ſetzen, und behauptet deswegen: „ein Gegenſtand, der idealiſch ſchön ſeyn ſoll, muſs eine beſtimmte Geſtalt haben; ſonſt könnte die Einbildungskraft kein Bild von ihm entwerfen und die Darſtellungskraft das Entworfene nicht ausführen.
bsb10502066_00100_8	1817	1	00100	GESCHICHTE	9	https://api.digitale-sammlungen.de/iiif/presentation/v2/bsb10502066/canvas/100/view	Die Vergleichung der entgegengeſetzten Berichte, die Zuſammenſetzung aus Urkunden, der für geringe Gegenſtände reichliche, für wichtige karge Stoff gebieten dem Schriftſteller (erlauben ihm nur), ſich in engen Schranken zu bewegen, und laſſen Leerheiten und Unvollkommenheiten, die er ſchmerzlich fühlt, die der Leſer ihm anrechnet und die zu vermeiden ſind, wenn man dem Feuer der Einbildungskraft freyen Spielraum läſst, und gegen die Wahrheit ſündigt.
bsb10502009_00215_32	1797	1	00215	SCHÖNE KÜNSTE	33	https://api.digitale-sammlungen.de/iiif/presentation/v2/bsb10502009/canvas/215/view	An ihm bewundern wir nicht allein die eben ſo rege als zarte, vielſeitige, ja man möchte beynah ſagen, allſeitige Empfänglichkeit; den reinen, unbeſtechlichen und dennoch milden Sinn, der, durch innige Verwandſchaft zu den Edelſten und Schönſten hingezogen, auch das Geringere nicht verſchmäht, wofern es der Menſchheit angehört; das innere Gleichgewicht, die ruhige Ueberlegenheit des Gemüths, wodurch es in den Stand geſetzt wird, eine Welt der verſchiedenartigſten Eindrücke, jeden in ſeiner Eigenheit, ohne Streit und Verwirrung in ſich zu bewahren; ſondern auch die Biegſamkeit, mit der ſich ſeine Einbildungskraft aller Formen bemächtigt, und, wie unverkennbar auch das Gepräge ſebſtſtändiger Beſtimmtheit in allem dem iſt, was er urſprünglich gedichtet hat, dennoch auch die Kunſtgebilde andrer Meiſter, aus den verſchiedenſten Zeiten und Völkern in treffenden Kopieen darzuſtellen verſteht.
bsb10502002_00080_9	1795	3	00080	PHILOSOPHIE	10	https://api.digitale-sammlungen.de/iiif/presentation/v2/bsb10502002/canvas/80/view	Der Vf. ſetzt den Wahnsinn nicht auf den verstand, ſondern in die Einbildungskraft und das Gedächtniſs.
bsb10502070_00375_39	1818	1	00375	PHILOSOPHIE	40	https://api.digitale-sammlungen.de/iiif/presentation/v2/bsb10502070/canvas/375/view	Analogieen kann man wohl zwiſchen der Sprache und dem Denken finden, weil die Sprache das gemeinſchaftliche Produkt der Einbildungskraft und des Verſtandes iſt, und die Einbildungskraft hierbey nach dem Geſetz der Aehnlichkeiten und nach Analogieen des Verſtandes verfährt.
bsb10502042_00266_107	1806	2	00266	SCHÖNE KÜNSTE	108	https://api.digitale-sammlungen.de/iiif/presentation/v2/bsb10502042/canvas/266/view	Ja auch ſelbſt die für Darſtellung der bildenden Künſte ſo ſchweren Traumgeſichte und Geiſtererſcheinungen ſind reich an Einbildungskraft, und doch gemäſsigt ohne Uebertreibung.
bsb10502057_00137_42	1814	4	00137	SCHÖNE KÜNSTE	43	https://api.digitale-sammlungen.de/iiif/presentation/v2/bsb10502057/canvas/137/view	Am allerſchwächften iſt aber der ſprechende Hund von Langbein, den man wohl für eine Schülerarbeit erklären möchte: es iſt, als wenn der Hausgeiſt Talpatſch, der ganz unnöthig erſcheint, die Geſchichte dem Vf. in die Feder geſagt hätte: denn Einbildungskraft und Verſtand haben nicht viel dazu beygetragen, ſondern geſchlummert.
bsb10502048_00087_57	1812	1	00087	PHILOSOPHIE	58	https://api.digitale-sammlungen.de/iiif/presentation/v2/bsb10502048/canvas/87/view	In dieſem, dem bey weitem ausführlichſten, wird zuerſt in ſieben Abtheilungen von dem Einfluſſe der Leidenſchaften auf den Verſand, die Einbildungskraft, die Sinne, den Willen, die freye Willkür, das ſinnliche Begehrugsvermögen, den Körper, dann umgekehrt, von dem Einfluſſe des Verſandes, der Einbildungskraft u. ſ. w., auf die Leidenſchaften gehandelt.
bsb10501977_00389_16	1788	3	00389	ARZNEYGELAHRTHEIT	17	https://api.digitale-sammlungen.de/iiif/presentation/v2/bsb10501977/canvas/389/view	Der Herausgeber entwickelt mit vielem philoſophiſchen Scharfſinn die natürlichen Urſachen der magnetiſchen Wunder und Wunderkuren, mit gehöriger Rückſicht auf Enthuſiaſmus, Einbildungskraft und Geſchlechtstrieb.
bsb10502082_00603_102	1821	1_2	00603	SCHÖNE KÜNSTE	103	https://api.digitale-sammlungen.de/iiif/presentation/v2/bsb10502082/canvas/603/view	Daſs dabey zu mehrerer Ausbildung dem Genie des Dichters Spielraum gelaſſen wurde, verſteht ſich von ſelbſt, und ſie war alſo in ſeinen Händen ein ſchönes Mittel zu ſinnlichergetzlicher, friſcher und lebendiger Darſtellung und der Reiz, das irdiſche Getriebe mit dem überirdiſchen in Verbindung zu ſehen, konnte hey einer ganz ſinnlichen Religion die Einbildungskraft vielfach beſchäftigen.
bsb10502080_00422_64	1820	3	00422	GESCHICHTE	65	https://api.digitale-sammlungen.de/iiif/presentation/v2/bsb10502080/canvas/422/view	Oft mag aber doch Hr. R. der Wahrheit näher kommen, als ſeine Vorgänger, da er genaue Lokalkenntniſſe zu beſitzen ſcheint, wenn gleich nicht zu verabreden iſt, daſs ſelbſt in ſolchem Falle Namensähnlichkeiten den Forſcher oft irre führen, oder die Einbildungskraft Spuren alter Ereigniſſe und Anlagen ihn finden laſſen, wo nur die Natur, oder ganz andere Urſachen, als die welche er zu finden wünſcht, gewirket haben.
bsb10502042_00386_65	1806	2	00386	PHILOSOPHIE	66	https://api.digitale-sammlungen.de/iiif/presentation/v2/bsb10502042/canvas/386/view	Der zweyte Verſuch enthält Dugald Stewarts Theorie der Einbildungskraft, nebſt einer klaren Ueberſicht der ſo ſehr abweichenden Begriffe der berühmteſten neuern Denker von der Einbildungskraft und ihrem Verhältniſs zum Gedächtniſs.
bsb10502018_00493_94	1800	2	00493	PHILOSOPHIE	95	https://api.digitale-sammlungen.de/iiif/presentation/v2/bsb10502018/canvas/493/view	5) Wirkung der Einbildungskraft einer ſchwangern Mutter auf ihr Kind.
